,movie_genres,movie_id,movie_title,poster_url,movie_url,description,rating,num_review,director,writer,cast,age_rating,year,movie_length,release_date,country,storyline
44,[ 7 15 16],270,Gattaca (1997),"https://m.media-amazon.com/images/M/MV5BODI3ZTc5NjktOGMyOC00NjYzLTgwZDYtYmQ4NDc1MmJjMjRlXkEyXkFqcGdeQXVyMTQxNzMzNDI@._V1_QL75_UX190_CR0,1,190,281_.jpg 190w, https://m.media-amazon.com/images/M/MV5BODI3ZTc5NjktOGMyOC00NjYzLTgwZDYtYmQ4NDc1MmJjMjRlXkEyXkFqcGdeQXVyMTQxNzMzNDI@._V1_QL75_UX285_CR0,2,285,422_.jpg 285w, https://m.media-amazon.com/images/M/MV5BODI3ZTc5NjktOGMyOC00NjYzLTgwZDYtYmQ4NDc1MmJjMjRlXkEyXkFqcGdeQXVyMTQxNzMzNDI@._V1_QL75_UX380_CR0,2,380,562_.jpg 380w",http://www.imdb.com/title/tt0119177/?ref_=fn_al_tt_1,A genetically inferior man assumes the identity of a superior one in order to pursue his lifelong dream of space travel.,7.8,291K,['Andrew Niccol'],['Andrew Niccol'],"['Ethan Hawke', 'Uma Thurman', 'Jude Law', 'Gore Vidal', 'Xander Berkeley', 'Jayne Brook', 'Elias Koteas', 'Maya Rudolph', 'Una Damon', 'Elizabeth Dennehy', 'Blair Underwood', 'Mason Gamble', 'Vincent Nielson', 'Chad Christ', 'William Lee Scott', 'Clarence Graham', 'Ernest Borgnine', 'Tony Shalhoub']",PG-13,1997.0,1h 46min,20-03-1998,United Kingdom,"In the not-too-distant future, a less-than-perfect man wants to travel to the stars. Society has categorized Vincent Freeman as less than suitable given his genetic make-up and he has become one of the underclass of humans that are only useful for menial jobs. To move ahead, he assumes the identity of Jerome Morrow, a perfect genetic specimen who is a paraplegic as a result of a car accident. With professional advice, Vincent learns to deceive DNA and urine sample testing. Just when he is finally scheduled for a space mission, his program director is killed and the police begin an investigation, jeopardizing his secret. —garykmcd"
45,[7],1666,Ripe (1996),"https://m.media-amazon.com/images/M/MV5BMjI1ODUyMzgyN15BMl5BanBnXkFtZTgwMzg5MjgwMzE@._V1_QL75_UY281_CR2,0,190,281_.jpg 190w, https://m.media-amazon.com/images/M/MV5BMjI1ODUyMzgyN15BMl5BanBnXkFtZTgwMzg5MjgwMzE@._V1_QL75_UY422_CR3,0,285,422_.jpg 285w, https://m.media-amazon.com/images/M/MV5BMjI1ODUyMzgyN15BMl5BanBnXkFtZTgwMzg5MjgwMzE@._V1_QL75_UY562_CR5,0,380,562_.jpg 380w",http://www.imdb.com/title/tt0117482/?ref_=fn_al_tt_1,"When their abusive parents are killed in a car crash, twin sisters Rosie and Violet vow to run away to Kentucky in search of a better life. While on the road, the girls meet up with Pete, a drifter working as a grounds keeper on a derelict army base, who takes them in. While Violet falls for him, Rosie becomes increasingly angry and hostile, and the sisters' childhood bond is eventually destroyed forever.",4.8,1.1K,['Mo Ogrodnik'],['Mo Ogrodnik'],"['Monica Keena', 'Daisy Eagan', 'Gordon Currie', 'Ron Brice', 'Karen Lynn Gorney', 'Vincent Laresca', 'Scott Sowers', 'Erik Jensen', 'Curtis McClarin', 'Donia Silver-Smith', 'Janna Silver-Smith', 'Nurit Koppel', 'Bruce McCarty', 'Candice Love', 'Hollie Harper', 'Jennifer Griffin Chambers', 'Mary Leonard', 'Zip Hanna']",R,1996.0,1h 32min,02-05-1997,United States,"When their abusive parents are killed in a car crash, twin sisters Rosie and Violet vow to run away to Kentucky in search of a better life. While on the road, the girls meet up with Pete, a drifter working as a grounds keeper on a derelict army base, who takes them in. While Violet falls for him, Rosie becomes increasingly angry and hostile, and the sisters' childhood bond is eventually destroyed forever. —Babydoll xxx"
46,[4],104,Theodore Rex (1995),"https://m.media-amazon.com/images/M/MV5BMGE2MDBhODctN2JhMy00NGRjLWFlZjAtNjk5MGUwNTBmMzJlXkEyXkFqcGdeQXVyMTQ2MjQyNDc@._V1_QL75_UX190_CR0,1,190,281_.jpg 190w, https://m.media-amazon.com/images/M/MV5BMGE2MDBhODctN2JhMy00NGRjLWFlZjAtNjk5MGUwNTBmMzJlXkEyXkFqcGdeQXVyMTQ2MjQyNDc@._V1_QL75_UX285_CR0,1,285,422_.jpg 285w, https://m.media-amazon.com/images/M/MV5BMGE2MDBhODctN2JhMy00NGRjLWFlZjAtNjk5MGUwNTBmMzJlXkEyXkFqcGdeQXVyMTQ2MjQyNDc@._V1_QL75_UX380_CR0,2,380,562_.jpg 380w",http://www.imdb.com/title/tt0114658/?ref_=fn_al_tt_1,"In an alternate futuristic society, a tough female police detective is paired with a talking dinosaur to find the killer of dinosaurs and other prehistoric animals leading them to a mad scientist bent on creating a new Armageddon.",2.4,4.5K,['Jonathan R. Betuel'],['Jonathan R. Betuel'],"['Whoopi Goldberg', 'Armin Mueller-Stahl', 'Juliet Landau', 'Bud Cort', 'Stephen McHattie', 'George Newbern', 'Carol Kane', 'Richard Roundtree', 'Jack Riley', 'Peter Mackenzie', 'Joe Dallesandro', 'Tony T. Johnson', 'Susie Coelho', 'Peter Kwong', 'Edith Diaz', 'Robert Martin Robinson', 'Dee Booher', 'William Boyett']",PG,1995.0,1h 32min,23-08-1996,United Kingdom,"In a future town a female police detective (Whoopi Goldberg) has to colaborate with Theodore Rex, a genetically generated Tyrannosaurus Rex, in order to investigate the murder of another dinosaur. —Volker Boehm"
47,[ 4 12],1079,Joe's Apartment (1996),"https://m.media-amazon.com/images/M/MV5BNzczODMyNGUtNjRmOS00ZTA3LWIxOTgtOGE2YmYwZDA2YWU1XkEyXkFqcGdeQXVyNzc5MjA3OA@@._V1_QL75_UX190_CR0,1,190,281_.jpg 190w, https://m.media-amazon.com/images/M/MV5BNzczODMyNGUtNjRmOS00ZTA3LWIxOTgtOGE2YmYwZDA2YWU1XkEyXkFqcGdeQXVyNzc5MjA3OA@@._V1_QL75_UX285_CR0,2,285,422_.jpg 285w, https://m.media-amazon.com/images/M/MV5BNzczODMyNGUtNjRmOS00ZTA3LWIxOTgtOGE2YmYwZDA2YWU1XkEyXkFqcGdeQXVyNzc5MjA3OA@@._V1_QL75_UX380_CR0,2,380,562_.jpg 380w",http://www.imdb.com/title/tt0116707/?ref_=fn_al_tt_1,"A nice guy has just moved to New York and discovers that he must share his run-down apartment with a couple thousand singing, dancing cockroaches.",5.5,13K,['John Payson'],['John Payson'],"[""Jerry O'Connell"", 'Megan Ward', 'Billy West', 'Reginald Hudlin', 'Jim Turner', 'Pepa', 'Robert Vaughn', 'Don Ho', 'Jim Sterling', 'Shiek Mahmud-Bey', 'David Huddleston', 'Frank Bello', 'Lord Kayson', 'Alex Molina', 'Wayman Ezell', 'Vincent Pastore', 'Rose Kimmel', 'Cynthia Neilson']",PG-13,1996.0,1h 20min,26-07-1996,United States,"Joe comes from Iowa to New York and, being short of money, wants to find an apartment with very low rent. His quest is successful, but he must share the residence with some 50,000 cockroaches. The insects turn out to be Joe's best friends. —Dragan Antulov "
48,[7],1097,"Hate (Haine, La) (1995)","https://m.media-amazon.com/images/M/MV5BNDNiOTA5YjktY2Q0Ni00ODgzLWE5MWItNGExOWRlYjY2MjBlXkEyXkFqcGdeQXVyNjQ2MjQ5NzM@._V1_QL75_UY281_CR4,0,190,281_.jpg 190w, https://m.media-amazon.com/images/M/MV5BNDNiOTA5YjktY2Q0Ni00ODgzLWE5MWItNGExOWRlYjY2MjBlXkEyXkFqcGdeQXVyNjQ2MjQ5NzM@._V1_QL75_UY422_CR5,0,285,422_.jpg 285w, https://m.media-amazon.com/images/M/MV5BNDNiOTA5YjktY2Q0Ni00ODgzLWE5MWItNGExOWRlYjY2MjBlXkEyXkFqcGdeQXVyNjQ2MjQ5NzM@._V1_QL75_UY562_CR7,0,380,562_.jpg 380w",http://www.imdb.com/title/tt0113247/?ref_=fn_al_tt_1,24 hours in the lives of three young men in the French suburbs the day after a violent riot.,8.1,161K,['Mathieu Kassovitz'],['Mathieu Kassovitz'],"['Vincent Cassel', 'Hubert Koundé', 'Saïd Taghmaoui', 'Abdel Ahmed Ghili', 'Solo', 'Joseph Momo', 'Héloïse Rauth', 'Rywka Wajsbrot', 'Olga Abrego', 'Laurent Labasse', 'Choukri Gabteni', 'Nabil Ben Mhamed', 'Benoît Magimel', 'Médard Niang', 'Arash Mansour', 'Abdel-Moulah Boujdouni', 'Mathilde Vitry', 'Christian Moro']",Not Rated,1995.0,1h 38min,17-11-1995,United Kingdom,"The film follows three young men and their time spent in the French suburban ""ghetto,"" over a span of twenty-four hours. Vinz, a Jew, Saïd, an Arab, and Hubert, a black boxer, have grown up in these French suburbs where high levels of diversity coupled with the racist and oppressive police force have raised tensions to a critical breaking point. During the riots that took place a night before, a police officer lost his handgun in the ensuing madness, only to leave it for Vinz to find. Now, with a newfound means to gain the respect he deserves, Vinz vows to kill a cop if his friend Abdel dies in the hospital, due the beating he received while in police custody. —b4arr2y"
49,[ 0 10],452,Jaws 2 (1978),"https://m.media-amazon.com/images/M/MV5BN2U1MWE1NTMtYjQ2ZC00MTFmLWFmYjItODMyNGYxOTAyZmEzXkEyXkFqcGdeQXVyMTQxNzMzNDI@._V1_QL75_UX190_CR0,5,190,281_.jpg 190w, https://m.media-amazon.com/images/M/MV5BN2U1MWE1NTMtYjQ2ZC00MTFmLWFmYjItODMyNGYxOTAyZmEzXkEyXkFqcGdeQXVyMTQxNzMzNDI@._V1_QL75_UX285_CR0,8,285,422_.jpg 285w, https://m.media-amazon.com/images/M/MV5BN2U1MWE1NTMtYjQ2ZC00MTFmLWFmYjItODMyNGYxOTAyZmEzXkEyXkFqcGdeQXVyMTQxNzMzNDI@._V1_QL75_UX380_CR0,11,380,562_.jpg 380w",http://www.imdb.com/title/tt0077766/?ref_=fn_al_tt_1,Police chief Brody must protect the citizens of Amity after a second monstrous shark begins terrorizing the waters.,5.8,75K,['Jeannot Szwarc'],"['Peter Benchley', 'Carl Gottlieb', 'Howard Sackler']","['Roy Scheider', 'Lorraine Gary', 'Murray Hamilton', 'Joseph Mascolo', 'Jeffrey Kramer', 'Collin Wilcox Paxton', 'Ann Dusenberry', 'Mark Gruner', 'Barry Coe', 'Susan French', 'Gary Springer', 'Donna Wilkes', 'Gary Dubin', 'John Dukakis', 'G. Thomas Dunlop', 'David Elliott', 'Marc Gilpin', 'Keith Gordon']",PG,1978.0,1h 56min,26-12-1978,United Kingdom,"Four years after the traumatic episodes at Amity Island that was terrorized by a 25-foot-long great white shark devouring beachgoers until it was destroyed, Amity Island is at peace and opened a hotel at the Holiday Inn. Days after the opening, beachgoers start to disappear, along with a beached, half-eaten killer whale. Brody becomes concerned about these incidents and fears that another Great White Shark is on the loose."
