,movie_genres,movie_id,movie_title,poster_url,movie_url,description,rating,num_review,director,writer,cast,age_rating,year,movie_length,release_date,country,storyline
14,[ 4 14],1525,"Object of My Affection, The (1998)","https://m.media-amazon.com/images/M/MV5BYmNjODYxOTMtNTBhMS00MmVhLWFiODUtYzYxMDA1MzNmZTEyXkEyXkFqcGdeQXVyMTMxMTY0OTQ@._V1_QL75_UX190_CR0,1,190,281_.jpg 190w, https://m.media-amazon.com/images/M/MV5BYmNjODYxOTMtNTBhMS00MmVhLWFiODUtYzYxMDA1MzNmZTEyXkEyXkFqcGdeQXVyMTMxMTY0OTQ@._V1_QL75_UX285_CR0,1,285,422_.jpg 285w, https://m.media-amazon.com/images/M/MV5BYmNjODYxOTMtNTBhMS00MmVhLWFiODUtYzYxMDA1MzNmZTEyXkEyXkFqcGdeQXVyMTMxMTY0OTQ@._V1_QL75_UX380_CR0,1,380,562_.jpg 380w",http://www.imdb.com/title/tt0120772/?ref_=fn_al_tt_1,"A pregnant New York City social worker begins to develop romantic feelings for her gay best friend, and decides she'd rather raise her child with him, much to the dismay of her overbearing boyfriend.",6.0,20K,['Nicholas Hytner'],"['Stephen McCauley', 'Wendy Wasserstein']","['Jennifer Aniston', 'Paul Rudd', 'Kali Rocha', 'Lena Cardwell', 'Natalie B. Kikkenborg', 'Lauren Pratt', 'Hayden Panettiere', 'Lauren Chen', 'Liam Aiken', 'Alan Alda', 'Allison Janney', 'Tim Daly', 'Janet Zarish', 'Ellen Tobie', 'Virl Andrick', 'Robert C. Lee', 'Bradley White', 'Marilyn Dobrin']",R,1998.0,1h 51min,26-06-1998,United Kingdom,"George and Nina seem like the perfect couple. They share a cozy Brooklyn apartment, a taste for tuna casserole dinners, and a devotion to ballroom dancing. They love each other. There's only one hitch: George is gay. And when Nina announces she's pregnant, things get especially complicated. Vince - Nina's overbearing boyfriend and the baby's father-wants marriage. Nina wants independence. George will do anything for a little unqualified affection, but is he ready to become an unwed surrogate dad? —Michael Kuroiwa "
15,[ 1 14],877,Excess Baggage (1997),"https://m.media-amazon.com/images/M/MV5BODNhMWY5NTctZTU2MS00NzRiLTk2MjktNmUyMTQ3Yzk0MTQ0XkEyXkFqcGdeQXVyMTQxNzMzNDI@._V1_QL75_UX190_CR0,3,190,281_.jpg 190w, https://m.media-amazon.com/images/M/MV5BODNhMWY5NTctZTU2MS00NzRiLTk2MjktNmUyMTQ3Yzk0MTQ0XkEyXkFqcGdeQXVyMTQxNzMzNDI@._V1_QL75_UX285_CR0,4,285,422_.jpg 285w, https://m.media-amazon.com/images/M/MV5BODNhMWY5NTctZTU2MS00NzRiLTk2MjktNmUyMTQ3Yzk0MTQ0XkEyXkFqcGdeQXVyMTQxNzMzNDI@._V1_QL75_UX380_CR0,6,380,562_.jpg 380w",http://www.imdb.com/title/tt0119086/?ref_=fn_al_tt_1,"A bratty teenager fakes her own kidnapping, but gets mistakenly kidnapped for real instead.",5.4,13K,['Marco Brambilla'],"['Max D. Adams', 'Dick Clement', 'Ian La Frenais']","['Alicia Silverstone', 'Benicio Del Toro', 'Christopher Walken', 'Jack Thompson', 'Harry Connick Jr.', 'Nicholas Turturro', 'Michael Bowen', 'Robert Wisden', 'Leland Orser', 'Sally Kirkland', 'Hiro Kanagawa', 'Brendan Beiser', 'Demetri Goritsas', 'Jorge Vargas', 'Danielle Saklofsky', 'Stacy Grant', 'Callum Keith Rennie', 'Carrie Cain-Sparks']",PG-13,1997.0,1h 41min,14-11-1997,United Kingdom,"Tired of feeling unloved and unwanted by her father and all other attempts of trying to get her fathers attention having failed, Emily fakes her own kidnapping and while locked in the trunk of her car, in comes a thief who steals her car not knowing she is in the trunk leading her to be accidentally kidnapped for real. Vincent the innocent car thief and Emily get off to a rough start but soon begin to bond and form a relationship, realizing they have more in common then they thought, all the while dealing with Emily's uncle and other criminals who are after them."
16,[7],344,"Apostle, The (1997)","https://m.media-amazon.com/images/M/MV5BNGRkMDZlNGUtMzVmMC00Y2UyLTg0YTYtMjAzZmQ2NmQyNjg1XkEyXkFqcGdeQXVyMTAwMzUyOTc@._V1_QL75_UY281_CR1,0,190,281_.jpg 190w, https://m.media-amazon.com/images/M/MV5BNGRkMDZlNGUtMzVmMC00Y2UyLTg0YTYtMjAzZmQ2NmQyNjg1XkEyXkFqcGdeQXVyMTAwMzUyOTc@._V1_QL75_UY422_CR1,0,285,422_.jpg 285w, https://m.media-amazon.com/images/M/MV5BNGRkMDZlNGUtMzVmMC00Y2UyLTg0YTYtMjAzZmQ2NmQyNjg1XkEyXkFqcGdeQXVyMTAwMzUyOTc@._V1_QL75_UY562_CR1,0,380,562_.jpg 380w",http://www.imdb.com/title/tt0118632/?ref_=fn_al_tt_1,"After his happy life spins out of control, a preacher from Texas changes his name, goes to Louisiana and starts preaching on the radio.",7.2,14K,['Robert Duvall'],['Robert Duvall'],"['Robert Duvall', 'Todd Allen', 'Paul Bagget', 'Lenore Banks', 'John Beasley', 'Mary Lynette Braxton', 'Brett Brock', 'Christopher Canady', 'Christian Canady', 'June Carter Cash', 'Elizabeth Chisolm', 'William Atlas Cole', 'Frank Collins Jr.', 'Carl D. Cook', 'Naomi Craig', 'Wayne Dehart', 'Rick Dial', 'Farrah Fawcett']",PG-13,1997.0,2h 14min,12-06-1998,United Kingdom,"Eulis 'Sonny' Dewey is a preacher from Texas living a happy life with his beautiful wife Jessie. Suddenly his stable world crumbles: Jessie is having an affair with young minister Horace. Sonny gets enraged and hits Horace with a softball bat, putting him into a coma. After that he leaves town, takes a new name, 'Apostle E.F.' and goes to Louisiana. There he starts to work as a mechanic for local radio station owner Elmo, and Elmo lets him preach on the radio. E.F. starts to preach everywhere: on the radio, on the streets, and with his new friend, Reverend Blackwell he starts a campaign to renovate an old church. —Anonymous"
17,[ 0 16],1019,"Die xue shuang xiong (Killer, The) (1989)","https://m.media-amazon.com/images/M/MV5BMDQyMDVhZjItMGI0Mi00MDQ1LTk3NmQtZmRjZGQ5ZTQ2ZDU5XkEyXkFqcGdeQXVyNTAyODkwOQ@@._V1_QL75_UX190_CR0,0,190,281_.jpg 190w, https://m.media-amazon.com/images/M/MV5BMDQyMDVhZjItMGI0Mi00MDQ1LTk3NmQtZmRjZGQ5ZTQ2ZDU5XkEyXkFqcGdeQXVyNTAyODkwOQ@@._V1_QL75_UX285_CR0,0,285,422_.jpg 285w, https://m.media-amazon.com/images/M/MV5BMDQyMDVhZjItMGI0Mi00MDQ1LTk3NmQtZmRjZGQ5ZTQ2ZDU5XkEyXkFqcGdeQXVyNTAyODkwOQ@@._V1_QL75_UX380_CR0,0,380,562_.jpg 380w",http://www.imdb.com/title/tt0097202/?ref_=fn_al_tt_1,A disillusioned assassin accepts one last hit in hopes of using his earnings to restore vision to a singer he accidentally blinded.,7.8,47K,['John Woo'],['John Woo'],"['Chow Yun-Fat', 'Danny Lee', 'Sally Yeh', 'Kong Chu', 'Kenneth Tsang', 'Fui-On Shing', 'Wing-Cho Yip', 'Ricky Wong Chun-Tong', 'Barry Wong', 'Parkman Wong', 'Alan Ng', 'Yamson Domingo', 'Siu Hung Ngan', 'Kwong Leung Wong', 'Chuen Chiang', 'Chin-Hung Fan', 'Woon-Ling Hau', 'Chung Lam']",R,1989.0,1h 51min,17-08-1990,United Kingdom,"A Hong Kong hit man accidentally blinds an innocent woman during a hit. He is determined to get her surgery to help regain her sight but he first needs to complete one more hit. He completes the job but then is ambushed as he tries to escape; someone wants him dead. Meanwhile, a resourceful and unorthodox police detective is hot on his trail. —grantss"
18,[7],1117,Surviving Picasso (1996),"https://m.media-amazon.com/images/M/MV5BMGJiYjFlZjItZWEyYS00NDk4LWJiZTctMDUzNmMzYmI5NDM5XkEyXkFqcGdeQXVyMTMxMTY0OTQ@._V1_QL75_UX190_CR0,0,190,281_.jpg 190w, https://m.media-amazon.com/images/M/MV5BMGJiYjFlZjItZWEyYS00NDk4LWJiZTctMDUzNmMzYmI5NDM5XkEyXkFqcGdeQXVyMTMxMTY0OTQ@._V1_QL75_UX285_CR0,0,285,422_.jpg 285w, https://m.media-amazon.com/images/M/MV5BMGJiYjFlZjItZWEyYS00NDk4LWJiZTctMDUzNmMzYmI5NDM5XkEyXkFqcGdeQXVyMTMxMTY0OTQ@._V1_QL75_UX380_CR0,0,380,562_.jpg 380w",http://www.imdb.com/title/tt0117791/?ref_=fn_al_tt_1,"The passionate Merchant Ivory drama tells the story of Françoise Gilot (Natascha McElhone), the only lover of Pablo Picasso (Sir Anthony Hopkins) who was strong enough to withstand his ferocious cruelty, and move on with her life.",6.4,7.3K,['James Ivory'],"['Arianna Huffington', 'Ruth Prawer Jhabvala']","['Anthony Hopkins', 'Natascha McElhone', 'Julianne Moore', 'Joss Ackland', 'Dennis Boutsikaris', 'Peter Eyre', 'Peter Gerety', 'Susannah Harker', 'Jane Lapotaire', 'Joseph Maher', 'Bob Peck', 'Diane Venora', 'Dominic West', 'Joan Plowright', 'Laura Aikman', 'Allegra Di Carpegna', 'Anthony Milner', 'Agapi Stassinopoulos']",R,1996.0,2h 5min,10-01-1997,United Kingdom,"In 1943, a young painter, Françoise Gilot (1921- ) (Natascha McElhone) meets Pablo Picasso (1881-1973) (Sir Anthony Hopkins), already the most celebrated artist in the world. For the next ten years, she is his mistress, bears him two children, is his muse, and paints within his element. She also learns slowly about the other women who have been or still are in his life: Dora Maar (Julianne Moore), Marie-Thérèse (Susannah Harker) (whose daughter is Picasso's), and Olga Koklowa (Jane Lapotaire), each of whom seems deeply scarred by their life with Picasso. Gilot's response is to bring each into her relationship with Picasso. How does one survive Picasso? She keeps painting, and she keeps her good humor and her independence. When the time comes, she has the strength to leave. —"
19,[10],672,Candyman (1992),"https://m.media-amazon.com/images/M/MV5BYjVjYjhlNTQtN2UxOC00Njk5LWFjNDctODNjZTI1ZGM0ZDZkXkEyXkFqcGdeQXVyMTQxNzMzNDI@._V1_QL75_UX190_CR0,0,190,281_.jpg 190w, https://m.media-amazon.com/images/M/MV5BYjVjYjhlNTQtN2UxOC00Njk5LWFjNDctODNjZTI1ZGM0ZDZkXkEyXkFqcGdeQXVyMTQxNzMzNDI@._V1_QL75_UX285_CR0,1,285,422_.jpg 285w, https://m.media-amazon.com/images/M/MV5BYjVjYjhlNTQtN2UxOC00Njk5LWFjNDctODNjZTI1ZGM0ZDZkXkEyXkFqcGdeQXVyMTQxNzMzNDI@._V1_QL75_UX380_CR0,1,380,562_.jpg 380w",http://www.imdb.com/title/tt0103919/?ref_=fn_al_tt_1,"The Candyman, a murderous soul with a hook for a hand, is accidentally summoned to reality by a skeptic grad student researching the monster's myth.",6.7,84K,['Bernard Rose'],"['Clive Barker', 'Bernard Rose']","['Virginia Madsen', 'Xander Berkeley', 'Tony Todd', 'Kasi Lemmons', 'Vanessa Williams', 'DeJuan Guy', 'Marianna Elliott', 'Ted Raimi', 'Ria Pavia', 'Mark Daniels', 'Lisa Ann Poggi', 'Adam Philipson', 'Eric Edwards', 'Carolyn Lowery', 'Barbara Alston', 'Sarina C. Grant', 'Latesha Martin', 'Lanesha Martin']",R,1992.0,1h 39min,19-03-1993,United Kingdom,"Helen Lyle is a student who decides to write a thesis about local legends and myths. She visits a part of the town, where she learns about the legend of the Candyman, a one-armed man who appears when you say his name five times, in front of a mirror. Of course, Helen doesn't believe all this stuff, but the people of the area are really afraid. When she ignores their warnings and begins her investigation in the places that he is rumored to appear, a series of horrible murders begins. Could the legend be true? —Chris Makrozahopoulos "
20,[3 4],996,"Big Green, The (1995)","https://m.media-amazon.com/images/M/MV5BNmY4NWVkM2UtY2FkZC00NWJiLTg5N2EtYzk4NjJkMGE0YzA3XkEyXkFqcGdeQXVyNTM5NzI0NDY@._V1_QL75_UX190_CR0,0,190,281_.jpg 190w, https://m.media-amazon.com/images/M/MV5BNmY4NWVkM2UtY2FkZC00NWJiLTg5N2EtYzk4NjJkMGE0YzA3XkEyXkFqcGdeQXVyNTM5NzI0NDY@._V1_QL75_UX285_CR0,1,285,422_.jpg 285w, https://m.media-amazon.com/images/M/MV5BNmY4NWVkM2UtY2FkZC00NWJiLTg5N2EtYzk4NjJkMGE0YzA3XkEyXkFqcGdeQXVyNTM5NzI0NDY@._V1_QL75_UX380_CR0,0,380,562_.jpg 380w",http://www.imdb.com/title/tt0112499/?ref_=fn_al_tt_1,"A teacher on exchange from England is placed in an underachieving Texan school, where she coaches the children in soccer, improving their self esteem and leading to unexpected success.",5.6,9.8K,['Holly Goldberg Sloan'],['Holly Goldberg Sloan'],"['Steve Guttenberg', ""Olivia d'Abo"", 'Jay O. Sanders', 'John Terry', 'Chauncey Leopardi', 'Patrick Renna', 'Billy L. Sullivan', 'Yareli Arizmendi', 'Bug Hall', 'Jessica Robertson', 'Anthony Esquivel', 'Jordan Brower', 'Hayley Kolb', 'Haley Miller', 'Ashley Welch', 'Ariel Welch', 'Jimmy Higa', 'Gil Glasgow']",PG,1995.0,1h 40min,29-09-1995,United States,"An underdog sports team of misfit kids learns to play a new sport and become champions while building self-esteem, making friends, and solving a variety of dramatic family crises through the able assistance of a foreign exchange teacher and former local sports hero as coaches. —Brian Fries "
21,[1 3],1531,Far From Home: The Adventures of Yellow Dog (1995),"https://m.media-amazon.com/images/M/MV5BYThiMDFmYWUtNTdjZC00ODcwLTgzNzgtMTE0MmMxZDg3Njg0XkEyXkFqcGdeQXVyNzc5MjA3OA@@._V1_QL75_UX190_CR0,0,190,281_.jpg 190w, https://m.media-amazon.com/images/M/MV5BYThiMDFmYWUtNTdjZC00ODcwLTgzNzgtMTE0MmMxZDg3Njg0XkEyXkFqcGdeQXVyNzc5MjA3OA@@._V1_QL75_UX285_CR0,1,285,422_.jpg 285w, https://m.media-amazon.com/images/M/MV5BYThiMDFmYWUtNTdjZC00ODcwLTgzNzgtMTE0MmMxZDg3Njg0XkEyXkFqcGdeQXVyNzc5MjA3OA@@._V1_QL75_UX380_CR0,1,380,562_.jpg 380w",http://www.imdb.com/title/tt0113028/?ref_=fn_al_tt_1,"Angus McCormick adopts a stray dog and names him Yellow. Several days later, while traveling along the coast of British Columbia with his father, John, he and Yellow become stranded when turbulent waters capsize their boat. John and his wife, Katherine, relentlessly badger rescue teams. Angus, schooled by John in wilderness survival skills, and assisted by intelligent Yellow, tries to attract rescuers.",6.4,2.9K,['Phillip Borsos'],['Phillip Borsos'],"['Jesse Bradford', 'Mimi Rogers', 'Bruce Davison', 'Tom Bower', 'Joel Palmer', 'Dakotah', 'Josh Wannamaker', 'Margot Finley', 'Matthew Bennett', 'St. Clair McColl', 'Jennifer Weissenborn', 'Gordon Neave', 'Karen Kruper', 'Dean Lockwood', 'John LeClair', 'Brent Stait']",PG,1995.0,1h 21min,07-04-1995,United Kingdom,"Angus McCormick adopts a stray dog and names him Yellow. Several days later, while traveling along the coast of British Columbia with his father, John, he and Yellow become stranded when turbulent waters capsize their boat. John and his wife, Katherine, relentlessly badger rescue teams. Angus, schooled by John in wilderness survival skills, and assisted by intelligent Yellow, tries to attract rescuers. —Ray Hamel "
22,[ 3  4 13],1444,That Darn Cat! (1965),"https://m.media-amazon.com/images/M/MV5BNzVlMGQ0MzgtNWM0NC00MWI1LThlYzUtNTkwZDVhOGVmZjI3XkEyXkFqcGdeQXVyMDUyOTUyNQ@@._V1_QL75_UX190_CR0,3,190,281_.jpg 190w, https://m.media-amazon.com/images/M/MV5BNzVlMGQ0MzgtNWM0NC00MWI1LThlYzUtNTkwZDVhOGVmZjI3XkEyXkFqcGdeQXVyMDUyOTUyNQ@@._V1_QL75_UX285_CR0,6,285,422_.jpg 285w, https://m.media-amazon.com/images/M/MV5BNzVlMGQ0MzgtNWM0NC00MWI1LThlYzUtNTkwZDVhOGVmZjI3XkEyXkFqcGdeQXVyMDUyOTUyNQ@@._V1_QL75_UX380_CR0,7,380,562_.jpg 380w",http://www.imdb.com/title/tt0059793/?ref_=fn_al_tt_1,"After a kidnapped bank teller uses a neighbor's wandering cat to send an S.O.S., the F.B.I. assigns a cat-allergic Agent to the case.",6.8,6.6K,['Robert Stevenson'],"['Gordon Gordon', 'Mildred Gordon', 'Bill Walsh']","['Hayley Mills', 'Dean Jones', 'Dorothy Provine', 'Roddy McDowall', 'Neville Brand', 'Elsa Lanchester', 'William Demarest', 'Frank Gorshin', 'Richard Eastham', 'Grayson Hall', 'Tom Lowell', 'Richard Deacon', 'Iris Adrian', 'Liam Sullivan', 'Don Dorrell', 'Gene Blakely', 'Karl Held', 'Ed Wynn']",Approved,1965.0,1h 56min,05-11-1965,United Kingdom,"A woman is kidnapped. While in captivity, she manages to send a message out with a wandering cat. The cat's owner calls the F.B.I. The F.B.I. tries to follow the cat. Jealous boyfriends and nosy neighbors also get into the act. —Rob Brown "
23,[ 4 14],1258,Trial and Error (1997),"https://m.media-amazon.com/images/M/MV5BNmY0NzM2ZTQtODZjOS00NGNmLWI5NWQtYzczZTk2NTM1YzIwXkEyXkFqcGdeQXVyNzc5MjA3OA@@._V1_QL75_UX190_CR0,4,190,281_.jpg 190w, https://m.media-amazon.com/images/M/MV5BNmY0NzM2ZTQtODZjOS00NGNmLWI5NWQtYzczZTk2NTM1YzIwXkEyXkFqcGdeQXVyNzc5MjA3OA@@._V1_QL75_UX285_CR0,7,285,422_.jpg 285w, https://m.media-amazon.com/images/M/MV5BNmY0NzM2ZTQtODZjOS00NGNmLWI5NWQtYzczZTk2NTM1YzIwXkEyXkFqcGdeQXVyNzc5MjA3OA@@._V1_QL75_UX380_CR0,9,380,562_.jpg 380w",http://www.imdb.com/title/tt0120373/?ref_=fn_al_tt_1,"An actor poses as a lawyer to help his sick friend, and problems develop.",5.8,7.5K,['Jonathan Lynn'],"['Sara Bernstein', 'Gregory Bernstein', 'Cliff Gardner']","['Michael Richards', 'Jeff Daniels', 'Charlize Theron', 'Jessica Steen', 'Austin Pendleton', 'Rip Torn', 'Alexandra Wentworth', 'Jennifer Coolidge', 'Lawrence Pressman', 'Dale Dye', 'Max Casella', 'McNally Sagal', 'Kenneth White', 'Keith Mills', 'Zaid Farid', 'Rachel Winfree', 'Ken Magee', 'Michelle C. Bonilla']",PG-13,1997.0,1h 38min,14-11-1997,United Kingdom,"Lawyer Charlie Tuttle is defending his wife's relative Benny Gibbs in a class action fraud suit, but when he gets to the city where court takes place, he gets drunk and the following day, when the hearings begin, his friend, actor Richard Rjetti takes his place posing as Charlie. The bad thing is that Richard doesn't know anything about being a lawyer, and Charlie has to teach him as the court goes on. —Marcos Eduardo Acosta Aldrete"
24,[ 7 16],1508,"Babysitter, The (1995)","https://m.media-amazon.com/images/M/MV5BMzBmZGRlNTktZDI0OS00ZmYxLTg0NjgtNzI1NDFlYzIyZTRmXkEyXkFqcGdeQXVyMTIwNjIxNQ@@._V1_QL75_UY281_CR46,0,190,281_.jpg 190w, https://m.media-amazon.com/images/M/MV5BMzBmZGRlNTktZDI0OS00ZmYxLTg0NjgtNzI1NDFlYzIyZTRmXkEyXkFqcGdeQXVyMTIwNjIxNQ@@._V1_QL75_UY422_CR68,0,285,422_.jpg 285w, https://m.media-amazon.com/images/M/MV5BMzBmZGRlNTktZDI0OS00ZmYxLTg0NjgtNzI1NDFlYzIyZTRmXkEyXkFqcGdeQXVyMTIwNjIxNQ@@._V1_QL75_UY562_CR91,0,380,562_.jpg 380w",http://www.imdb.com/title/tt7222308/?ref_=fn_al_tt_1,A teenage boy and his little sister are thrust into an adrenaline-charged adventure when they find out their gregarious babysitter is in fact the legendary super hero known as Agent-Action.,,,['William Butler'],['William Butler'],"['Melissa Peterman', 'Mo Collins', ""Jim O'Heir"", 'Maile Flanagan', 'Wayne Wilderson', 'Alex Skuby', 'Paul Vogt', 'Justin Ellings', 'Chloe Ray Warmoth', 'Rigo Obezo', 'Brian Goff', 'Rissa Kilar', 'Talin Chat', 'Alexander Jesus Burgos', 'Selwyn Huqueriza', 'Gaige Chaturantabut', 'Joseph Fiorello', 'Zoephia']",,2021.0,1h 30min,17-05-2022,United States,A teenage boy and his little sister are thrust into an adrenaline-charged adventure when they find out their gregarious babysitter is in fact the legendary super hero known as Agent-Action.
25,[ 7  8 16],558,Heavenly Creatures (1994),"https://m.media-amazon.com/images/M/MV5BZjUwNGIwNDctZmQ1ZC00YTEzLWI3MzQtZGMyODlmZGU4ZDdhXkEyXkFqcGdeQXVyMTQxNzMzNDI@._V1_QL75_UX190_CR0,3,190,281_.jpg 190w, https://m.media-amazon.com/images/M/MV5BZjUwNGIwNDctZmQ1ZC00YTEzLWI3MzQtZGMyODlmZGU4ZDdhXkEyXkFqcGdeQXVyMTQxNzMzNDI@._V1_QL75_UX285_CR0,5,285,422_.jpg 285w, https://m.media-amazon.com/images/M/MV5BZjUwNGIwNDctZmQ1ZC00YTEzLWI3MzQtZGMyODlmZGU4ZDdhXkEyXkFqcGdeQXVyMTQxNzMzNDI@._V1_QL75_UX380_CR0,7,380,562_.jpg 380w",http://www.imdb.com/title/tt0110005/?ref_=fn_al_tt_1,"Two teenage girls share a unique bond; their parents, concerned that the friendship is too intense, separate them, and the girls take revenge.",7.3,62K,['Peter Jackson'],"['Fran Walsh', 'Peter Jackson']","['Melanie Lynskey', 'Kate Winslet', 'Sarah Peirse', 'Diana Kent', 'Clive Merrison', ""Simon O'Connor"", 'Jed Brophy', 'Peter Elliott', 'Gilbert Goldie', 'Geoffrey Heath', 'Kirsti Ferry', 'Ben Skjellerup', 'Darien Takle', 'Elizabeth Moody', 'Liz Mullane', 'Moreen Eason', 'Pearl Carpenter', 'Lou Dobson']",R,1994.0,1h 39min,10-02-1995,United Kingdom,"Pauline Parker and Juliet Hulme met in school during the 1950s. Instant best friends, they proceeded to spend every minute possible together, often writing about a fantasy land of their own invention. More and more estranged from their respective families, the two girls realise that they are extremely different from most other people, and agree to take any steps necessary to ensure that they are not separated. The two families are increasingly concerned about the girls' friendship in a strictly moralistic era. —Murray Chapman "
26,[ 4 14 16],402,Ghost (1990),"https://m.media-amazon.com/images/M/MV5BMmE4ZjI3YzctNjM0YS00MjBlLWFmYjItNDRiNTk0ZmRkYjVjXkEyXkFqcGdeQXVyNjc3MjQzNTI@._V1_QL75_UX190_CR0,0,190,281_.jpg 190w, https://m.media-amazon.com/images/M/MV5BMmE4ZjI3YzctNjM0YS00MjBlLWFmYjItNDRiNTk0ZmRkYjVjXkEyXkFqcGdeQXVyNjc3MjQzNTI@._V1_QL75_UX285_CR0,0,285,422_.jpg 285w, https://m.media-amazon.com/images/M/MV5BMmE4ZjI3YzctNjM0YS00MjBlLWFmYjItNDRiNTk0ZmRkYjVjXkEyXkFqcGdeQXVyNjc3MjQzNTI@._V1_QL75_UX380_CR0,0,380,562_.jpg 380w",http://www.imdb.com/title/tt0099653/?ref_=fn_al_tt_1,"After a young man is murdered, his spirit stays behind to warn his lover of impending danger, with the help of a reluctant psychic.",7.1,206K,['Jerry Zucker'],['Bruce Joel Rubin'],"['Patrick Swayze', 'Demi Moore', 'Whoopi Goldberg', 'Tony Goldwyn', 'Stanley Lawrence', 'Christopher J. Keene', 'Susan Breslau', 'Martina Deignan', 'Rick Kleber', 'Macka Foley', 'Rick Aviles', 'Phil Leeds', 'John Hugh', 'Sam Tsoutsouvas', 'Sharon Breslau', 'Vincent Schiavelli', 'Angelina Estrada', 'Armelia McQueen']",PG-13,1990.0,2h 7min,05-10-1990,United Kingdom,"Even though Sam Wheat, the successful investment counsellor, still finds it difficult to express his deeper feelings for her after all these years, his young potter girlfriend, Molly Jensen, is the love of his life. However, a curious case of a systematic discrepancy will prepare the ground for a hideous urban homicide in one of Manhattan's dark alleys, trapping, seemingly forever, the unfortunate deceased's immortal soul in the realm of the mortals. With the condemned spirit unable to interact with the physical world--and as Molly's life, too, is in grave danger--Sam will have to turn to the spiritual medium, Oda Mae Brown, to warn and protect her. Can Oda and the ghost settle the unfinished business in time? —Nick Riganas"
27,[4],108,Kids in the Hall: Brain Candy (1996),"https://m.media-amazon.com/images/M/MV5BZDJlZDE4N2UtMjhjMC00ZWYyLWFiNjItZjI1NjY0MDE3YjE4XkEyXkFqcGdeQXVyNzc5MjA3OA@@._V1_QL75_UX190_CR0,2,190,281_.jpg 190w, https://m.media-amazon.com/images/M/MV5BZDJlZDE4N2UtMjhjMC00ZWYyLWFiNjItZjI1NjY0MDE3YjE4XkEyXkFqcGdeQXVyNzc5MjA3OA@@._V1_QL75_UX285_CR0,4,285,422_.jpg 285w, https://m.media-amazon.com/images/M/MV5BZDJlZDE4N2UtMjhjMC00ZWYyLWFiNjItZjI1NjY0MDE3YjE4XkEyXkFqcGdeQXVyNzc5MjA3OA@@._V1_QL75_UX380_CR0,5,380,562_.jpg 380w",http://www.imdb.com/title/tt0116768/?ref_=fn_al_tt_1,"A pharmaceutical scientist creates a pill that makes people remember their happiest memory, and although it's successful, it has unfortunate side effects.",6.9,8.5K,['Kelly Makin'],"['Norm Hiscock', 'Bruce McCulloch', 'Kevin McDonald']","['Dave Foley', 'Bruce McCulloch', 'Kevin McDonald', 'Mark McKinney', 'Scott Thompson', 'Kathryn Greenwood', 'Amy Smith', 'Lachlan Murdoch', 'Nicole de Boer', 'Krista Bridges', 'Christopher Redman', 'Erica Fairfield', 'Jackie Harris Greenberg', 'Jonathan Wilson', 'Tony Ning', 'Jason Barr', 'Jack Jessop', 'Sharon Dyer']",R,1996.0,1h 29min,08-11-1996,United Kingdom,"A team of scientists working for a pharmaceutical company discovers a cure for depression. When the company finds itself in trouble financially, they rush the new drug into production without doing enough testing. Things seem to go fine until some of the users of the drug start slipping into comas. It becomes a race between the scientists who want to tell the world the truth and the company's marketing department who wants to protect their profit margin. —Jeff Stanley"
28,[ 0  1 15],229,Star Trek III: The Search for Spock (1984),"https://m.media-amazon.com/images/M/MV5BMTliZGVjZmMtNzEzMy00MzVhLWFhYjYtNDhlYmViNGNiMGFlXkEyXkFqcGdeQXVyMTQxNzMzNDI@._V1_QL75_UX190_CR0,1,190,281_.jpg 190w, https://m.media-amazon.com/images/M/MV5BMTliZGVjZmMtNzEzMy00MzVhLWFhYjYtNDhlYmViNGNiMGFlXkEyXkFqcGdeQXVyMTQxNzMzNDI@._V1_QL75_UX285_CR0,2,285,422_.jpg 285w, https://m.media-amazon.com/images/M/MV5BMTliZGVjZmMtNzEzMy00MzVhLWFhYjYtNDhlYmViNGNiMGFlXkEyXkFqcGdeQXVyMTQxNzMzNDI@._V1_QL75_UX380_CR0,3,380,562_.jpg 380w",http://www.imdb.com/title/tt0088170/?ref_=fn_al_tt_1,Admiral Kirk and his bridge crew risk their careers stealing the decommissioned U.S.S. Enterprise to return to the restricted Genesis Planet to recover Spock's body.,6.7,78K,['Leonard Nimoy'],"['Gene Roddenberry', 'Harve Bennett']","['William Shatner', 'Leonard Nimoy', 'DeForest Kelley', 'James Doohan', 'Walter Koenig', 'George Takei', 'Nichelle Nichols', 'Robin Curtis', 'Merritt Butrick', 'Phil Morris', 'Scott McGinnis', 'Robert Hooks', 'Carl Steven', 'Vadia Potenza', 'Stephen Manley', 'Joe W. Davis', 'Paul Sorensen', 'Cathie Shirriff']",PG,1984.0,1h 45min,27-07-1984,United Kingdom,"In the wake of Spock's ultimate deed of sacrifice, Admiral Kirk and the Enterprise crew return to Earth for some essential repairs to their ship. When they arrive at Spacedock, they are shocked to discover that the Enterprise is to be decommissioned. Even worse, Dr. McCoy begins acting strangely and Scotty has been reassigned to another ship. Kirk is forced to steal back the Enterprise and head across space to the Genesis Planet to save Spock and bring him to Vulcan. Unbeknownst to them, the Klingons are planning to steal the secrets of the Genesis Device for their own deadly purpose. —Colin Tinto "
