,movie_genres,movie_id,movie_title,poster_url,movie_url,description,rating,num_review,director,writer,cast,age_rating,year,movie_length,release_date,country,storyline
29,[ 4 14],1040,Two if by Sea (1996),"https://m.media-amazon.com/images/M/MV5BY2YwZjVkMjItYjY4Yy00M2QyLTg0Y2MtYmFiNTgzMjNmMmQzXkEyXkFqcGdeQXVyNzc5MjA3OA@@._V1_QL75_UX190_CR0,2,190,281_.jpg 190w, https://m.media-amazon.com/images/M/MV5BY2YwZjVkMjItYjY4Yy00M2QyLTg0Y2MtYmFiNTgzMjNmMmQzXkEyXkFqcGdeQXVyNzc5MjA3OA@@._V1_QL75_UX285_CR0,3,285,422_.jpg 285w, https://m.media-amazon.com/images/M/MV5BY2YwZjVkMjItYjY4Yy00M2QyLTg0Y2MtYmFiNTgzMjNmMmQzXkEyXkFqcGdeQXVyNzc5MjA3OA@@._V1_QL75_UX380_CR0,4,380,562_.jpg 380w",http://www.imdb.com/title/tt0118002/?ref_=fn_al_tt_1,A couple steals a Matisse painting on contract. They manage to escape the police. The sale takes place 4 days later on an island. Things don't go as planned.,5.3,5.7K,['Bill Bennett'],"['Denis Leary', 'Mike Armstrong', 'Ann Lembeck']","['Sandra Bullock', 'Denis Leary', 'Stephen Dillane', 'Yaphet Kotto', 'Mike Starr', 'Jonathan Tucker', 'Wayne Robson', 'Michael Badalucco', 'Lenny Clarke', 'Jonny Fido', 'Don Gavin', 'Shaun Clarke', 'Markus Parilo', 'John Friesen', 'Sean Runnette', 'Ian White', 'Jane Moffat', 'Richard Fitzpatrick']",R,1996.0,1h 36min,05-04-1996,United Kingdom,"Petty thief Frank O'Brien and Roz, his girlfriend of seven years, want to end their unsteady lifestyle with one last job: stealing a painting. Frank takes Roz to an island off the coast of New England where he wants to sell the painting and also revive their relationship. Nothing goes as planned as thugs and the FBI try to recover the painting and Roz gets attracted to more than just the landscape. —Thomas Meyer "
30,[7],475,Trainspotting (1996),"https://m.media-amazon.com/images/M/MV5BMzA5Zjc3ZTMtMmU5YS00YTMwLWI4MWUtYTU0YTVmNjVmODZhXkEyXkFqcGdeQXVyNjU0OTQ0OTY@._V1_QL75_UX190_CR0,0,190,281_.jpg 190w, https://m.media-amazon.com/images/M/MV5BMzA5Zjc3ZTMtMmU5YS00YTMwLWI4MWUtYTU0YTVmNjVmODZhXkEyXkFqcGdeQXVyNjU0OTQ0OTY@._V1_QL75_UX285_CR0,0,285,422_.jpg 285w, https://m.media-amazon.com/images/M/MV5BMzA5Zjc3ZTMtMmU5YS00YTMwLWI4MWUtYTU0YTVmNjVmODZhXkEyXkFqcGdeQXVyNjU0OTQ0OTY@._V1_QL75_UX380_CR0,0,380,562_.jpg 380w",http://www.imdb.com/title/tt0117951/?ref_=fn_al_tt_1,"Renton, deeply immersed in the Edinburgh drug scene, tries to clean up and get out, despite the allure of the drugs and influence of friends.",8.1,658K,['Danny Boyle'],"['Irvine Welsh', 'John Hodge']","['Ewan McGregor', 'Ewen Bremner', 'Jonny Lee Miller', 'Kevin McKidd', 'Robert Carlyle', 'Kelly Macdonald', 'Peter Mullan', 'James Cosmo', 'Eileen Nicholas', 'Susan Vidler', 'Pauline Lynch', 'Shirley Henderson', 'Stuart McQuarrie', 'Irvine Welsh', 'Dale Winton', 'Keith Allen', 'Kevin Allen', 'Annie Louise Ross']",R,1996.0,1h 33min,23-02-1996,United Kingdom,"A wild, freeform, Rabelaisian trip through the darkest recesses of Edinburgh low-life, focusing on Mark Renton and his attempt to give up his heroin habit, and how the latter affects his relationship with family and friends: Sean Connery wannabe Sick Boy, dimbulb Spud, psycho Begbie, 14-year-old girlfriend Diane, and clean-cut athlete Tommy, who's never touched drugs but can't help being curious about them... —Michael Brooke "
31,[4],42,Clerks (1994),"https://m.media-amazon.com/images/M/MV5BNzE1Njk0NmItNDhlMC00ZmFlLWI4ZTUtYTY4ZjgzNjkyMTU1XkEyXkFqcGdeQXVyMTQxNzMzNDI@._V1_QL75_UX190_CR0,2,190,281_.jpg 190w, https://m.media-amazon.com/images/M/MV5BNzE1Njk0NmItNDhlMC00ZmFlLWI4ZTUtYTY4ZjgzNjkyMTU1XkEyXkFqcGdeQXVyMTQxNzMzNDI@._V1_QL75_UX285_CR0,3,285,422_.jpg 285w, https://m.media-amazon.com/images/M/MV5BNzE1Njk0NmItNDhlMC00ZmFlLWI4ZTUtYTY4ZjgzNjkyMTU1XkEyXkFqcGdeQXVyMTQxNzMzNDI@._V1_QL75_UX380_CR0,4,380,562_.jpg 380w",http://www.imdb.com/title/tt0109445/?ref_=fn_al_tt_1,"A day in the lives of two convenience clerks named Dante and Randal as they annoy customers, discuss movies, and play hockey on the store roof.",7.7,217K,['Kevin Smith'],['Kevin Smith'],"[""Brian O'Halloran"", 'Jeff Anderson', 'Marilyn Ghigliotti', 'Lisa Spoonauer', 'Jason Mewes', 'Kevin Smith', 'Scott Mosier', 'Scott Schiaffo', 'Al Berkowitz', 'Walter Flanagan', 'Ed Hapstak', 'Lee Bendick', 'David Klein', 'Pattijean Csik', 'Ken Clark', 'Donna Jeanne', 'Virginia Smith', 'Betsy Broussard']",R,1994.0,1h 32min,05-05-1995,United Kingdom,Dante Hicks is not having a good day. He clerks in a small convenience store and is told to come into work on his day off. Dante thinks life is a series of down endings and this day proves to be no different. He reads in the newspaper that his ex-girlfriend Caitlin is getting married. His present girlfriend reveals to have somewhat more experience with sex that he thought. His principal concerns are the hockey game he has that afternoon and the wake for a friend who died. His buddy Randal Graves works as a clerk in the video store next door and he hates his job as much as Dante hates his. —garykmcd
32,[7],1169,Fresh (1994),"https://m.media-amazon.com/images/M/MV5BODVhZjZhOGYtMTg5OC00YjllLWEwNTMtNmUyMWExMmU0MTJlXkEyXkFqcGdeQXVyMTk0MjQ3Nzk@._V1_QL75_UY281_CR2,0,190,281_.jpg 190w, https://m.media-amazon.com/images/M/MV5BODVhZjZhOGYtMTg5OC00YjllLWEwNTMtNmUyMWExMmU0MTJlXkEyXkFqcGdeQXVyMTk0MjQ3Nzk@._V1_QL75_UY422_CR2,0,285,422_.jpg 285w, https://m.media-amazon.com/images/M/MV5BODVhZjZhOGYtMTg5OC00YjllLWEwNTMtNmUyMWExMmU0MTJlXkEyXkFqcGdeQXVyMTk0MjQ3Nzk@._V1_QL75_UY562_CR3,0,380,562_.jpg 380w",http://www.imdb.com/title/tt0109842/?ref_=fn_al_tt_1,"Death and violence anger a twelve-year-old drug courier, who sets his employers against each other.",7.6,13K,['Boaz Yakin'],['Boaz Yakin'],"['Sean Nelson', 'Giancarlo Esposito', 'Samuel L. Jackson', ""N'Bushe Wright"", 'Ron Brice', 'Jean-Claude La Marre', 'José Zúñiga', 'Luis Lantigua', 'Yul Vazquez', 'Cheryl Freeman', 'Anthony Thomas', 'Curtis McClarin', 'Charles Malik Whitfield', 'Víctor González', 'Guillermo Díaz', 'Robert Jimenez', 'Jerome Butler', 'Cortez Nance Jr.']",R,1994.0,1h 54min,12-05-1995,United Kingdom,"Fresh (Sean Nelson) is a 12-year-old drug dealer who finds himself trapped in a web of poverty, corruption and racial tension in Brooklyn, New York. When his drug-addict sister Nichole (N'Bushe Wright) starts sleeping with local drug lord Esteban (Giancarlo Esposito), Fresh calls upon the skills he learned playing chess with his alcoholic father and speed-chess champion Sam (Samuel L. Jackson) and devises a complex strategy that will free both himself and his sister. —heem857"
33,[ 0 16],349,Hard Rain (1998),"https://m.media-amazon.com/images/M/MV5BZWVlYTJjNjEtNzY2Yy00YzA0LWEwMjMtOGFjNjIwYTk1ZDhjXkEyXkFqcGdeQXVyMTQxNzMzNDI@._V1_QL75_UY281_CR1,0,190,281_.jpg 190w, https://m.media-amazon.com/images/M/MV5BZWVlYTJjNjEtNzY2Yy00YzA0LWEwMjMtOGFjNjIwYTk1ZDhjXkEyXkFqcGdeQXVyMTQxNzMzNDI@._V1_QL75_UY422_CR0,0,285,422_.jpg 285w, https://m.media-amazon.com/images/M/MV5BZWVlYTJjNjEtNzY2Yy00YzA0LWEwMjMtOGFjNjIwYTk1ZDhjXkEyXkFqcGdeQXVyMTQxNzMzNDI@._V1_QL75_UY562_CR1,0,380,562_.jpg 380w",http://www.imdb.com/title/tt0120696/?ref_=fn_al_tt_1,The partner and nephew of an armored-truck driver tries to prevent three million dollars from being taken by a gang during a catastrophic flooding caused by a severe storm.,5.9,35K,['Mikael Salomon'],['Graham Yost'],"['Morgan Freeman', 'Christian Slater', 'Randy Quaid', 'Minnie Driver', 'Ed Asner', 'Michael A. Goorjian', 'Dann Florek', 'Ricky Harris', 'Mark Rolston', 'Peter Murnik', 'Wayne Duvall', 'Richard Dysart', 'Betty White', 'Ray Baker', 'Lisa Fuhrman', 'Jay Patterson', 'Michael Monks', 'Mackenzie Bryce']",R,1998.0,1h 37min,03-04-1998,United Kingdom,"In the small town of Huntingburg, the armored truck with three million dollars driven by Tom and his Uncle Charlie gets stuck in the flooding. They realize that the town has been evacuated since the dam does not have capacity to hold the storm. While waiting for the National Guard, they are attacked by Jim and his gang formed by Kenny, Mr. Mehlor and Ray and the clumsy Kenny kills Charlie. Tom flees with the bags of money and hides them in the cemetery. Then he is hunted down by Jim and his gang and he hides in a church. Out of the blue, he is knocked out and awakes locked in a cell. Soon he learns that the restorer Karen believed he was a looter and hit him. Sheriff Mike Collins and Deputy Wayne Bryce go to investigate Tom' story while Officer Phil takes Karen out of the town by boat. However she escapes with the boat and goes to the church. Meanwhile Tom is trapped in the cell full of water and Karen rescues him. He decides to return to the armored truck to retrieve a shotgun but he is captured by Jim and his men and learns that Charlie was part of the gang. He tries to retrieve the hidden money for the gang, but Sheriff Collins and his men have already taken it. Soon Tom learns that the Sheriff wants to keep the money for him and his men and Tom and Karen are witnesses and he teams up with Jim."
34,[3 7],1063,"Little Princess, A (1995)","https://m.media-amazon.com/images/M/MV5BZDQzMGE5ODYtZDdiNC00MzZjLTg2NjAtZTk0ODlkYmY4MTQzXkEyXkFqcGdeQXVyMTQxNzMzNDI@._V1_QL75_UX190_CR0,2,190,281_.jpg 190w, https://m.media-amazon.com/images/M/MV5BZDQzMGE5ODYtZDdiNC00MzZjLTg2NjAtZTk0ODlkYmY4MTQzXkEyXkFqcGdeQXVyMTQxNzMzNDI@._V1_QL75_UX285_CR0,4,285,422_.jpg 285w, https://m.media-amazon.com/images/M/MV5BZDQzMGE5ODYtZDdiNC00MzZjLTg2NjAtZTk0ODlkYmY4MTQzXkEyXkFqcGdeQXVyMTQxNzMzNDI@._V1_QL75_UX380_CR0,5,380,562_.jpg 380w",http://www.imdb.com/title/tt0113670/?ref_=fn_al_tt_1,A young girl is relegated to servitude at a boarding school when her father goes missing and is presumed dead.,7.7,33K,['Alfonso Cuarón'],"['Frances Hodgson Burnett', 'Richard LaGravenese', 'Elizabeth Chandler']","['Liesel Matthews', 'Eleanor Bron', 'Liam Cunningham', 'Rusty Schwimmer', 'Arthur Malet', 'Vanessa Chester', 'Errol Sitahal', 'Heather DeLoach', 'Taylor Fry', 'Darcie Bradford', 'Rachael Bella', 'Alexandra Rea-Baum', 'Camilla Belle', 'Lauren Blumenfeld', 'Kelsey Mulrooney', 'Kaitlin Cullum', 'Alison Moir', 'Time Winters']",G,1995.0,1h 37min,09-02-1996,United Kingdom,"When her father enlists to fight for the British in WWI, young Sara Crewe goes to New York to attend the same boarding school her late mother attended. She soon clashes with the severe headmistress, Miss Minchin, who attempts to stifle Sara's creativity and sense of self-worth. Sara's belief that ""every girl's a princess"" is tested to the limit, however, when word comes that her father was killed in action and his estate has been seized by the British government. —James Meek "
35,[10],774,"Prophecy, The (1995)","https://m.media-amazon.com/images/M/MV5BZjM4N2I0ZjYtMTFmNC00ZGQ0LWIzNmMtZDZjNzIwOGM1NzA0XkEyXkFqcGdeQXVyMTQxNzMzNDI@._V1_QL75_UY281_CR0,0,190,281_.jpg 190w, https://m.media-amazon.com/images/M/MV5BZjM4N2I0ZjYtMTFmNC00ZGQ0LWIzNmMtZDZjNzIwOGM1NzA0XkEyXkFqcGdeQXVyMTQxNzMzNDI@._V1_QL75_UY422_CR0,0,285,422_.jpg 285w, https://m.media-amazon.com/images/M/MV5BZjM4N2I0ZjYtMTFmNC00ZGQ0LWIzNmMtZDZjNzIwOGM1NzA0XkEyXkFqcGdeQXVyMTQxNzMzNDI@._V1_QL75_UY562_CR0,0,380,562_.jpg 380w",http://www.imdb.com/title/tt0114194/?ref_=fn_al_tt_1,"At the scene of a bizarre murder, L.A. homicide detective Thomas Dagget discovers a lethal heavenly prophecy now being fulfilled on earth. In his fight to stop the forces of evil, he finds an unlikely ally in an elementary school teacher.",6.5,30K,['Gregory Widen'],['Gregory Widen'],"['Christopher Walken', 'Elias Koteas', 'Virginia Madsen', 'Eric Stoltz', 'Viggo Mortensen', 'Amanda Plummer', ""Moriah 'Shining Dove' Snyder"", 'Adam Goldberg', 'Steve Hytner', 'J.C. Quinn', 'Emma Shenah', 'Albert Nelson', 'Shawn Nelson', 'Emily Conforto', 'Sioux-z Jessup', 'Sandra Ellis Lafferty', ""William 'Buck' Hart"", 'Christina Holmes']",R,1995.0,1h 38min,01-09-1995,United States,"At the scene of a bizarre murder, L.A. homicide detective Thomas Dagget discovers a lethal heavenly prophecy now being fulfilled on earth. Yet in his fight to stop the forces of evil, led by the powerful angel Gabriel, Dagget finds an unlikely ally in an elementary school teacher. Together they race against time and terror to save the world as we know it. —Anonymous"
36,[7],735,Philadelphia (1993),"https://m.media-amazon.com/images/M/MV5BNDE0MWE1ZTMtOWFkMS00YjdiLTkwZTItMDljYjY3MjM0NTk5XkEyXkFqcGdeQXVyNDYyMDk5MTU@._V1_QL75_UX190_CR0,2,190,281_.jpg 190w, https://m.media-amazon.com/images/M/MV5BNDE0MWE1ZTMtOWFkMS00YjdiLTkwZTItMDljYjY3MjM0NTk5XkEyXkFqcGdeQXVyNDYyMDk5MTU@._V1_QL75_UX285_CR0,3,285,422_.jpg 285w, https://m.media-amazon.com/images/M/MV5BNDE0MWE1ZTMtOWFkMS00YjdiLTkwZTItMDljYjY3MjM0NTk5XkEyXkFqcGdeQXVyNDYyMDk5MTU@._V1_QL75_UX380_CR0,4,380,562_.jpg 380w",http://www.imdb.com/title/tt0107818/?ref_=fn_al_tt_1,"When a man with HIV is fired by his law firm because of his condition, he hires a homophobic small time lawyer as the only willing advocate for a wrongful dismissal suit.",7.7,233K,['Jonathan Demme'],['Ron Nyswaner'],"['Tom Hanks', 'Denzel Washington', 'Roberta Maxwell', 'Buzz Kilman', 'Karen Finley', 'Daniel Chapman', 'Mark Sorensen Jr.', 'Jeffrey Williamson', 'Charles Glenn', 'Ron Vawter', 'Anna Deavere Smith', 'Stephanie Roth Haberle', 'Lisa Talerico', 'Joanne Woodward', 'Jason Robards', 'Robert Ridgely', 'Chandra Wilson', 'Ford Wheeler']",PG-13,1993.0,2h 5min,25-02-1994,United Kingdom,"Fearing compromise to his career, lawyer Andrew Beckett hides his homosexuality and HIV status at a powerful Philadelphia law firm, but his secret is exposed when a colleague spots the illness' telltale lesions. Fired shortly afterwards, Beckett resolves to sue for discrimination, and teams up with Joe Miller (Denzel Washington), the only lawyer willing to help. In court, they face one of his ex-employers' top litigators, Belinda Conine. —SAMUEL AXON"
37,[2 3],1412,Land Before Time III: The Time of the Great Giving (1995) (V),"https://m.media-amazon.com/images/M/MV5BMTI1OTU3NjkwMl5BMl5BanBnXkFtZTYwOTU2MDg5._V1_QL75_UY281_CR4,0,190,281_.jpg 190w, https://m.media-amazon.com/images/M/MV5BMTI1OTU3NjkwMl5BMl5BanBnXkFtZTYwOTU2MDg5._V1_QL75_UY422_CR5,0,285,422_.jpg 285w, https://m.media-amazon.com/images/M/MV5BMTI1OTU3NjkwMl5BMl5BanBnXkFtZTYwOTU2MDg5._V1_QL75_UY562_CR7,0,380,562_.jpg 380w",http://www.imdb.com/title/tt0113596/?ref_=fn_al_tt_1,"When a sudden shortage of water threatens all life in the great valley, The gang of young dinosaur must cooperate with a group of bullies to make a risky journey outside the valley and find the cause.",5.7,5.9K,['Roy Allen Smith'],"['Dev Ross', 'Judy Freudberg', 'Tony Geiss']","['Scott McAfee', 'Candace Hutson', 'Heather Hogan', 'Jeff Bennett', 'Rob Paulsen', 'John Ingle', 'Linda Gary', 'Whit Hertford', 'Nicholas Guest', 'Tress MacNeille', 'Frank Welker', 'Scott Menville', 'Kenneth Mars']",,,,01-01-1996,United Kingdom,When a meteorite had trapped all their water supply Littlefield and the team (which is the young crew) set out to find a new source of water in which this forces them to leave their home and are being confronted by a gang of mean dinosaurs will they ever work together? —Marah durman.
38,[18],1529,Underground (1995),"https://m.media-amazon.com/images/M/MV5BNzI4YTVmMWEtMWQ3MS00OGE1LWE5YjMtNjc4NWJmYjRmZTQyXkEyXkFqcGdeQXVyNTA4NzY1MzY@._V1_QL75_UY281_CR3,0,190,281_.jpg 190w, https://m.media-amazon.com/images/M/MV5BNzI4YTVmMWEtMWQ3MS00OGE1LWE5YjMtNjc4NWJmYjRmZTQyXkEyXkFqcGdeQXVyNTA4NzY1MzY@._V1_QL75_UY422_CR4,0,285,422_.jpg 285w, https://m.media-amazon.com/images/M/MV5BNzI4YTVmMWEtMWQ3MS00OGE1LWE5YjMtNjc4NWJmYjRmZTQyXkEyXkFqcGdeQXVyNTA4NzY1MzY@._V1_QL75_UY562_CR6,0,380,562_.jpg 380w",http://www.imdb.com/title/tt0114787/?ref_=fn_al_tt_1,"A group of Serbian socialists prepares for the war in a surreal underground filled by parties, tragedies, love and hate.",8.1,57K,['Emir Kusturica'],"['Dusan Kovacevic', 'Emir Kusturica']","[""Predrag 'Miki' Manojlovic"", 'Lazar Ristovski', 'Mirjana Jokovic', 'Slavko Stimac', 'Ernst Stötzner', ""Srdjan 'Zika' Todorovic"", 'Mirjana Karanovic', 'Milena Pavlovic', ""Danilo 'Bata' Stojkovic"", 'Bora Todorovic', 'Davor Dujmovic', 'Nele Karajlic', 'Branislav Lecic', 'Dragan Nikolic', 'Erol Kadic', 'Predrag Zagorac', 'Hark Bohm', 'Petar Kralj']",Not Rated,1995.0,2h 47min,08-03-1996,United Kingdom,"The story follows an underground weapons manufacturer in Belgrade during WWII and evolves into fairly surreal situations. A black-marketeer who smuggles the weapons to partisans doesn't mention to the workers that the war is over, and they keep producing. Years later, they break out of their underground ""shelter""--only to convince themselves that the war is still going on. —Anonymous"
39,[6],857,Paris Was a Woman (1995),"https://m.media-amazon.com/images/M/MV5BMTM5NDk3MDI4MF5BMl5BanBnXkFtZTcwNjAzOTYyMQ@@._V1_QL75_UY281_CR5,0,190,281_.jpg 190w, https://m.media-amazon.com/images/M/MV5BMTM5NDk3MDI4MF5BMl5BanBnXkFtZTcwNjAzOTYyMQ@@._V1_QL75_UY422_CR7,0,285,422_.jpg 285w, https://m.media-amazon.com/images/M/MV5BMTM5NDk3MDI4MF5BMl5BanBnXkFtZTcwNjAzOTYyMQ@@._V1_QL75_UY562_CR9,0,380,562_.jpg 380w",http://www.imdb.com/title/tt0114093/?ref_=fn_al_tt_1,"Female artists, writers, photographers, designers, and adventurers are settled in Paris between the wars.",7.3,170,['Greta Schiller'],['Andrea Weiss'],"['Juliet Stevenson', 'Maureen All', 'Gillian Hanna', 'Margaret Robertson', 'Shari Benstock', 'Alice B. Toklas', 'Gertrude Stein', 'Janet Flanner', 'Samuel Steward', 'Sylvia Beach', 'Adrienne Monnier', 'Giselle Freund', 'John Bernard', 'Berthe Cleyrerque', 'Catharine Stimpson', 'Josephine Baker', 'Colette', 'James Joyce']",Not Rated,1996.0,1h 15min,08-11-1996,United States,"Female (many of them lesbian) artists, writers, photographers, designers, and adventurers settled in Paris between the wars. They embraced France, some developed an ex-pat culture, and most cherished a way of life quite different than the one left behind. Archival footage, music, paintings, literature, and interviews with folks who were there. Berenice Abbott, Gisele Freund, Djuna Barnes, Natalie Barney, Sylvia Beach, Adrienne Monnier, Gertrude Stein, Alice B. Toklas, Colette, Janet Flanner and others. In addition, Matisse, Picasso, Hemingway, and James Joyce. —Eileen Berdon "
40,[4 7],723,Boys on the Side (1995),"https://m.media-amazon.com/images/M/MV5BMDlhZGNiNmItODQ4NS00OTk3LWI2MDctMDZmODFjN2NlODExXkEyXkFqcGdeQXVyMTQxNzMzNDI@._V1_QL75_UX190_CR0,1,190,281_.jpg 190w, https://m.media-amazon.com/images/M/MV5BMDlhZGNiNmItODQ4NS00OTk3LWI2MDctMDZmODFjN2NlODExXkEyXkFqcGdeQXVyMTQxNzMzNDI@._V1_QL75_UX285_CR0,1,285,422_.jpg 285w, https://m.media-amazon.com/images/M/MV5BMDlhZGNiNmItODQ4NS00OTk3LWI2MDctMDZmODFjN2NlODExXkEyXkFqcGdeQXVyMTQxNzMzNDI@._V1_QL75_UX380_CR0,2,380,562_.jpg 380w",http://www.imdb.com/title/tt0112571/?ref_=fn_al_tt_1,"Robin shares a ride in her car with Jane from New York to Los Angeles. They stop at Jane's friend Holly's place in Pittsburgh and take her with them west, making a long stop in Tucson. The three very different women become close friends.",6.5,13K,['Herbert Ross'],['Don Roos'],"['Whoopi Goldberg', 'Mary-Louise Parker', 'Drew Barrymore', 'Matthew McConaughey', 'James Remar', 'Billy Wirth', 'Anita Gillette', 'Dennis Boutsikaris', 'Estelle Parsons', 'Amy Aquino', 'Stan Egi', 'Stephen Gevedon', 'Amy Ray', 'Emily Saliers', 'Jude Ciccolella', 'Gedde Watanabe', 'Jon Seda', 'Mimi Toro']",R,1995.0,1h 55min,12-05-1995,United Kingdom,"Jane is a night club singer out of work. Robin is a quirky real estate agent looking for a ride-share to accompany her to Los Angeles. Her advertisement is answered by Jane, who at first was uncertain about her. A stop in Pittsburgh picks up a third, Holly, escaping a violent and drug dealing partner. Girls on the road, reaching understanding, respect, and care for each other. But this trio is different - Jane a lesbian, Robin suffering with AIDS, Holly running from her past, seeking one night stands, and a good man. —Bruce Cameron "
41,[0 4],881,Money Talks (1997),"https://m.media-amazon.com/images/M/MV5BMjk5MjM2MjUtMDI3YS00ZTIwLWFjMDQtYzFhZDY0YTUxZmJkXkEyXkFqcGdeQXVyNzc5MjA3OA@@._V1_QL75_UX190_CR0,3,190,281_.jpg 190w, https://m.media-amazon.com/images/M/MV5BMjk5MjM2MjUtMDI3YS00ZTIwLWFjMDQtYzFhZDY0YTUxZmJkXkEyXkFqcGdeQXVyNzc5MjA3OA@@._V1_QL75_UX285_CR0,5,285,422_.jpg 285w, https://m.media-amazon.com/images/M/MV5BMjk5MjM2MjUtMDI3YS00ZTIwLWFjMDQtYzFhZDY0YTUxZmJkXkEyXkFqcGdeQXVyNzc5MjA3OA@@._V1_QL75_UX380_CR0,7,380,562_.jpg 380w",http://www.imdb.com/title/tt0119695/?ref_=fn_al_tt_1,"Sought by police and criminals, a small-time huckster makes a deal with a TV newsman for protection.",6.2,29K,['Brett Ratner'],"['Joel Cohen', 'Alec Sokolow']","['Charlie Sheen', 'Chris Tucker', 'Heather Locklear', 'Elise Neal', 'Paul Sorvino', 'David Lee McLain', 'Vic Ferreira', 'Gary Briggs', 'Larry Hankin', 'Nathan Anderson', 'Damian Chapa', 'Richard Noyce', 'Faizon Love', 'Gérard Ismaël', 'Ralph W. Odum', 'Frank Bruynbroek', 'David Warner', 'Doug Llewelyn']",R,1997.0,1h 37min,10-04-1998,United Kingdom,"Chris Tucker is a small time con man who instantly becomes famous after a murder, wanted dead or alive, his only hope is a journalist named James Russell (Sheen). —Jerome Hotman"
42,[ 4 14],83,Much Ado About Nothing (1993),"https://m.media-amazon.com/images/M/MV5BY2Q3YTU4OTgtZTc0My00YmY1LWJmOTQtMmMwNGE2ZjBmNmIxXkEyXkFqcGdeQXVyMTAwMzUyOTc@._V1_QL75_UX190_CR0,0,190,281_.jpg 190w, https://m.media-amazon.com/images/M/MV5BY2Q3YTU4OTgtZTc0My00YmY1LWJmOTQtMmMwNGE2ZjBmNmIxXkEyXkFqcGdeQXVyMTAwMzUyOTc@._V1_QL75_UX285_CR0,0,285,422_.jpg 285w, https://m.media-amazon.com/images/M/MV5BY2Q3YTU4OTgtZTc0My00YmY1LWJmOTQtMmMwNGE2ZjBmNmIxXkEyXkFqcGdeQXVyMTAwMzUyOTc@._V1_QL75_UX380_CR0,0,380,562_.jpg 380w",http://www.imdb.com/title/tt0107616/?ref_=fn_al_tt_1,"Young lovers Hero and Claudio, soon to wed, conspire to get verbal sparring partners and confirmed singles Benedick and Beatrice to wed as well.",7.3,47K,['Kenneth Branagh'],"['William Shakespeare', 'Kenneth Branagh']","['Kenneth Branagh', 'Emma Thompson', 'Keanu Reeves', 'Kate Beckinsale', 'Richard Briers', 'Imelda Staunton', 'Jimmy Yuill', 'Brian Blessed', 'Andy Hockley', 'Chris Barnes', 'Conrad Nelson', 'Phyllida Law', 'Alex Lowe', 'Denzel Washington', 'Richard Clifford', 'Gerard Horan', 'Robert Sean Leonard', 'Patrick Doyle']",PG-13,1993.0,1h 51min,27-08-1993,United Kingdom,"Young lovers, Hero (Kate Beckinsale) and Claudio (Robert Sean Leonard), are to be married in one week. To pass the time, they conspire with Don Pedro (Denzel Washington) to set a ""lover's trap"" for Benedick (Sir Kenneth Branagh), an arrogant confirmed bachelor, and Beatrice (Dame Emma Thompson), his favorite sparring partner. Meanwhile, the evil Don Jon (Keanu Reeves) conspires to break up the wedding by accusing Hero of infidelity. In the end though, it all turns out to be ""much ado about nothing."" —Liza Esser "
43,[0],1362,American Strays (1996),"https://m.media-amazon.com/images/M/MV5BZmQ0MGVlZTctYjNjYi00MGU5LThkNTctOWRmOGY3MTVhOThmL2ltYWdlXkEyXkFqcGdeQXVyNTE4MzAyNDk@._V1_QL75_UX190_CR0,4,190,281_.jpg 190w, https://m.media-amazon.com/images/M/MV5BZmQ0MGVlZTctYjNjYi00MGU5LThkNTctOWRmOGY3MTVhOThmL2ltYWdlXkEyXkFqcGdeQXVyNTE4MzAyNDk@._V1_QL75_UX285_CR0,7,285,422_.jpg 285w, https://m.media-amazon.com/images/M/MV5BZmQ0MGVlZTctYjNjYi00MGU5LThkNTctOWRmOGY3MTVhOThmL2ltYWdlXkEyXkFqcGdeQXVyNTE4MzAyNDk@._V1_QL75_UX380_CR0,9,380,562_.jpg 380w",http://www.imdb.com/title/tt0115531/?ref_=fn_al_tt_1,"The film is three stories about one story, featuring an exciting and quirky cast of characters living on the edge.",5.3,678,['Michael Covert'],['Michael Covert'],"['Scott Plank', 'Melora Walters', 'John Savage', 'Brion James', 'Joe Viterelli', 'James Russo', 'Luke Perry', 'Will Rothhaar', 'Jessica Perelman', 'Toni Kalem', 'Eric Roberts', 'Vonte Sweet', 'Anthony Lee', 'Stephanie Cushna', 'Sam J. Jones', 'Stace Williamson', 'Carol Kane', 'Luana Anders']",R,1996.0,1h 37min,13-09-1996,United States,"The desert can be a lonely place for the people who live there or for those who are traveling through. It is also the teller of different stories including the story of a traveling salesman whose only commodity is death and the story of a young man who finds that the death that he wishes for is difficult to find. Others are just traveling through, on their way to another place when they stop to eat at Red's Desert Oasis. The food may not be great, and the waitress may be surly, but those who stopped at Red's will find that they are involved in the showdown of their life. —Tony Fontana "
