,movie_genres,movie_id,movie_title,poster_url,movie_url,description,rating,num_review,director,writer,cast,age_rating,year,movie_length,release_date_x,country_x,release_date_y,country_y,storyline
15,[4 7],47,Ed Wood (1994),"https://m.media-amazon.com/images/M/MV5BNTA5ZjdjNWUtZGUwNy00N2RhLWJiZmItYzFhYjU1NmYxNjY4XkEyXkFqcGdeQXVyMTQxNzMzNDI@._V1_QL75_UX190_CR0,0,190,281_.jpg 190w, https://m.media-amazon.com/images/M/MV5BNTA5ZjdjNWUtZGUwNy00N2RhLWJiZmItYzFhYjU1NmYxNjY4XkEyXkFqcGdeQXVyMTQxNzMzNDI@._V1_QL75_UX285_CR0,0,285,422_.jpg 285w, https://m.media-amazon.com/images/M/MV5BNTA5ZjdjNWUtZGUwNy00N2RhLWJiZmItYzFhYjU1NmYxNjY4XkEyXkFqcGdeQXVyMTQxNzMzNDI@._V1_QL75_UX380_CR0,0,380,562_.jpg 380w",http://www.imdb.com/title/tt0109707/?ref_=fn_al_tt_1,"Ambitious but troubled movie director Edward D. Wood Jr. tries his best to fulfill his dreams, despite his lack of talent.",7.8,171K,['Tim Burton'],"['Rudolph Grey', 'Scott Alexander', 'Larry Karaszewski']","['Johnny Depp', 'Martin Landau', 'Sarah Jessica Parker', 'Patricia Arquette', 'Jeffrey Jones', 'G.D. Spradlin', ""Vincent D'Onofrio"", 'Bill Murray', 'Mike Starr', 'Max Casella', 'Brent Hinkley', 'Lisa Marie', ""George 'The Animal' Steele"", 'Juliet Landau', 'Clive Rosengren', 'Norman Alden', 'Leonard Termo', 'Ned Bellamy']",R,1994.0,2h 7min,26-05-1995,United Kingdom,26-05-1995,United Kingdom,"Because of his eccentric habits and bafflingly strange films, director Edward D. Wood Jr. is a Hollywood outcast. Nevertheless, with the help of the formerly famous Bela Lugosi and a devoted cast and crew of show-business misfits who believe in Ed's off-kilter vision, the filmmaker is able to bring his oversize dreams to cinematic life. Despite a lack of critical or commercial success, Ed and his friends manage to create an oddly endearing series of extremely low-budget films. —Jwelch5742"
16,[ 0 16],226,Die Hard 2 (1990),"https://m.media-amazon.com/images/M/MV5BMzMzYzk3ZTEtZDg0My00MTY5LWE3ZmQtYzNhYjhjN2RhZGRjL2ltYWdlXkEyXkFqcGdeQXVyNTAyODkwOQ@@._V1_QL75_UX190_CR0,0,190,281_.jpg 190w, https://m.media-amazon.com/images/M/MV5BMzMzYzk3ZTEtZDg0My00MTY5LWE3ZmQtYzNhYjhjN2RhZGRjL2ltYWdlXkEyXkFqcGdeQXVyNTAyODkwOQ@@._V1_QL75_UX285_CR0,0,285,422_.jpg 285w, https://m.media-amazon.com/images/M/MV5BMzMzYzk3ZTEtZDg0My00MTY5LWE3ZmQtYzNhYjhjN2RhZGRjL2ltYWdlXkEyXkFqcGdeQXVyNTAyODkwOQ@@._V1_QL75_UX380_CR0,0,380,562_.jpg 380w",http://www.imdb.com/title/tt0099423/?ref_=fn_al_tt_1,"John McClane attempts to avert disaster as rogue military operatives seize control of Dulles International Airport in Washington, D.C.",7.1,348K,['Renny Harlin'],"['Steven E. de Souza', 'Doug Richardson', 'Walter Wager']","['Bruce Willis', 'William Atherton', 'Bonnie Bedelia', 'Reginald VelJohnson', 'Franco Nero', 'William Sadler', 'John Amos', 'Dennis Franz', 'Art Evans', 'Fred Thompson', 'Tom Bower', 'Sheila McCarthy', 'Don Harvey', 'Tony Ganios', 'Peter Nelson', 'Robert Patrick', 'Mick Cunningham', 'John Leguizamo']",R,1990.0,2h 4min,24-08-1990,United Kingdom,24-08-1990,United Kingdom,"After the terrifying events in LA, John McClane (Willis) is about to go through it all again. A team of terrorists, led by Col. Stuart (Sadler) is holding the entire airport hostage. The terrorists are planning to rescue a drug lord from justice. In order to do so, they have seized control of all electrical equipment affecting all planes. With no runway lights available, all aircraft have to remain in the air, with fuel running low, McClane will need to be fast. —Film_Fan"
17,[ 0  7 16],1491,Tough and Deadly (1995),"https://m.media-amazon.com/images/M/MV5BZGU5ZDkxZWEtOWI0My00NGU4LTk4Y2EtOTFkNDcwMTNhZmM2XkEyXkFqcGdeQXVyMTQxNzMzNDI@._V1_QL75_UX190_CR0,5,190,281_.jpg 190w, https://m.media-amazon.com/images/M/MV5BZGU5ZDkxZWEtOWI0My00NGU4LTk4Y2EtOTFkNDcwMTNhZmM2XkEyXkFqcGdeQXVyMTQxNzMzNDI@._V1_QL75_UX285_CR0,7,285,422_.jpg 285w, https://m.media-amazon.com/images/M/MV5BZGU5ZDkxZWEtOWI0My00NGU4LTk4Y2EtOTFkNDcwMTNhZmM2XkEyXkFqcGdeQXVyMTQxNzMzNDI@._V1_QL75_UX380_CR0,9,380,562_.jpg 380w",http://www.imdb.com/title/tt0114706/?ref_=fn_al_tt_1,"Elmo Freech is a private investigator and was contracted by John Portland, a CIA agent who suffers amnesia, in oder to reveale a dubious case of drug smuggling in which are involved big fishes of the CIA and from Washington.",5.8,489,['Steve Cohen'],"['Steve Cohen', 'Otto C. Pozzo']","['Billy Blanks', 'Roddy Piper', 'Richard Norton', 'Charles Kahlenberg', 'James Karen', 'Gary Kasper', 'Sal Landi', 'Phil Morris', 'Lisa Stahl', 'Brant von Hoffman', 'Frank Di Paolo', 'Ronald E. House', 'Lisa Comshaw', 'Robert Werhan', 'Ed Berke', 'Wendy Oates', 'Kimberley Simms', 'Jack Serino']",,,,14-02-1995,United States,14-02-1995,United States,"Elmo Freech is a private investigator and was contracted by John Portland, a CIA agent who suffers amnesia, in oder to reveale a dubious case of drug smuggling in which are involved big fishes of the CIA and from Washington. —Volker Boehm"
18,[7],1623,"Cérémonie, La (1995)","https://m.media-amazon.com/images/M/MV5BYTk3MWNkN2QtMWUxNC00ZmNiLTk5ZjgtMzVhODgxZmY3NmIzXkEyXkFqcGdeQXVyNTcwNjUwNzk@._V1_QL75_UY281_CR11,0,190,281_.jpg 190w, https://m.media-amazon.com/images/M/MV5BYTk3MWNkN2QtMWUxNC00ZmNiLTk5ZjgtMzVhODgxZmY3NmIzXkEyXkFqcGdeQXVyNTcwNjUwNzk@._V1_QL75_UY422_CR16,0,285,422_.jpg 285w, https://m.media-amazon.com/images/M/MV5BYTk3MWNkN2QtMWUxNC00ZmNiLTk5ZjgtMzVhODgxZmY3NmIzXkEyXkFqcGdeQXVyNTcwNjUwNzk@._V1_QL75_UY562_CR21,0,380,562_.jpg 380w",http://www.imdb.com/title/tt0112769/?ref_=fn_al_tt_1,A newly hired maid for a rich countryside family befriends a post-office clerk who encourages her to rebel against her employers.,7.5,11K,['Claude Chabrol'],"['Ruth Rendell', 'Claude Chabrol', 'Caroline Eliacheff']","['Isabelle Huppert', 'Sandrine Bonnaire', 'Jacqueline Bisset', 'Jean-Pierre Cassel', 'Virginie Ledoyen', 'Valentin Merlet', 'Julien Rochefort', 'Dominique Frot', 'Jean-François Perrier', 'Ludovic Brillant', 'Claire Chiron', 'Claire-Marie Dentraygues', 'Jean-Pierre Descheix', 'Penny Fairclough', 'Alain Françoise', 'David Gabison', 'Pierre Gondard', 'Claire Ifrane']",Not Rated,1995.0,1h 52min,08-03-1996,United Kingdom,08-03-1996,United Kingdom,"The upper-class owner of a gallery, Catherine Lelievre, hires the efficient and quiet maid Sophie to work in the family manor in the French countryside. Her husband Georges Lelievre, who is an opera lover, her daughter Melinda and her teenage son Gilles welcome Sophie and appreciate her work. Sophie soon befriends the postmistress Jeanne, who is a bad egg and encourages Sophie to rebel against her employers, but the maid stays submissive. However, Sophie is ashamed of a secret and feels uncomfortable in many situations, finding a way to hide her secret. When Georges tells Sophie that he does not want Jeanne in his house, Sophie stands up to him. Melinda discovers her secret and Sophie blackmails her, but Melinda tells her parents what happened. Georges fires Sophie and she returns to the house later with Jeanne on the rampage. —Claudio Carvalho, Rio de Janeiro, Brazil"
19,[3 4],932,First Kid (1996),"https://m.media-amazon.com/images/M/MV5BNmM1ZjAzODMtMjQ3NS00NmQ4LWI4OWMtYzk4ZWM4MGY2ZDcxXkEyXkFqcGdeQXVyNjc4ODQwNzg@._V1_QL75_UX190_CR0,0,190,281_.jpg 190w, https://m.media-amazon.com/images/M/MV5BNmM1ZjAzODMtMjQ3NS00NmQ4LWI4OWMtYzk4ZWM4MGY2ZDcxXkEyXkFqcGdeQXVyNjc4ODQwNzg@._V1_QL75_UX285_CR0,1,285,422_.jpg 285w, https://m.media-amazon.com/images/M/MV5BNmM1ZjAzODMtMjQ3NS00NmQ4LWI4OWMtYzk4ZWM4MGY2ZDcxXkEyXkFqcGdeQXVyNjc4ODQwNzg@._V1_QL75_UX380_CR0,1,380,562_.jpg 380w",http://www.imdb.com/title/tt0116311/?ref_=fn_al_tt_1,"A former boxer turned Secret Service agent is assigned to protect the President's son, who seems determined to make life difficult for his new protector.",5.3,11K,['David Mickey Evans'],['Tim Kelleher'],"['Sinbad', 'Brock Pierce', 'Blake Boyd', 'Timothy Busfield', 'Art LaFleur', 'Robert Guillaume', 'Lisa Eichhorn', 'James Naughton', 'Fawn Reed', 'Erin Williby', 'Zachery Ty Bryan', 'Michael Krawic', 'Bill Cobbs', 'Jemar Jefferson', 'Daniel Baron', 'Joe Inscoe', 'J. Michael Hunter', 'Tomas Arana']",PG,1996.0,1h 41min,02-01-1998,United Kingdom,02-01-1998,United Kingdom,"Luke Davenport is the thirteen-year-old son of Paul Davenport, the President of the United States, and first lady Linda Davenport. Ill tempered Agent Woods is the secret service agent in charge of Luke. Woods is fired after mistreating Luke in front of the press. Woods is then replaced by former boxer Sam Simms, who won a boxing title in 1977. Sam is eager to take the job - even though no one else wants it. Everyone thinks that Luke is just a brat when the only thing Luke wants is to just fit in and be like every other kid at his school, the Georgetown Academy. Sam almost gets fired when Luke gets decked at school by school bully Rob MacArthur. This is when Sam decides to use his boxing expertise to teach Luke how to fight. Luke has his eyes on class-mate Katie Warren, but so does Rob. Katie agrees to go with Luke to an upcoming school dance, so Sam teaches Luke how to dance. Rob is also at the dance, but this time when Rob tries to deck Luke, Luke turns the tables and decks Rob. Sam is then fired for taking Luke to the dance without permission, although Luke had the permission of his parents, but secret service chief Morton didn't want Luke leaving the White House grounds while Luke's parents were on the campaign trail. Luke runs away anyway to meet a friend that he has been chatting on the internet with. The meeting is set to take place at a local mall where Luke discovers that his secret friend is a now psychotic Woods, who blames Luke for his firing and wants revenge on Luke, but not if Sam can help it."
20,[ 4 14],873,Picture Perfect (1997),"https://m.media-amazon.com/images/M/MV5BY2UwN2E0ZGItYmM3NC00ODVkLTkxOGItNGQ1NDMxMDdiMjQ0XkEyXkFqcGdeQXVyNTIzOTk5ODM@._V1_QL75_UX190_CR0,1,190,281_.jpg 190w, https://m.media-amazon.com/images/M/MV5BY2UwN2E0ZGItYmM3NC00ODVkLTkxOGItNGQ1NDMxMDdiMjQ0XkEyXkFqcGdeQXVyNTIzOTk5ODM@._V1_QL75_UX285_CR0,2,285,422_.jpg 285w, https://m.media-amazon.com/images/M/MV5BY2UwN2E0ZGItYmM3NC00ODVkLTkxOGItNGQ1NDMxMDdiMjQ0XkEyXkFqcGdeQXVyNTIzOTk5ODM@._V1_QL75_UX380_CR0,3,380,562_.jpg 380w",http://www.imdb.com/title/tt0119896/?ref_=fn_al_tt_1,"A young advertising executive's life becomes increasingly complicated when, in order to impress her boss, she pretends to be engaged to a man she has just met.",5.5,20K,['Glenn Gordon Caron'],"['Arleen Sorkin', 'Paul Slansky', 'May Quigley']","['Jennifer Aniston', 'Jay Mohr', 'Kevin Bacon', 'Olympia Dukakis', 'Illeana Douglas', 'Kevin Dunn', 'Anne Twomey', 'Faith Prince', 'John Rothman', 'Meg Gibson', 'Paul Cassell', 'Ivar Brogger', 'Peter McRobbie', 'Bray Poor', 'Daryl Edwards', 'Jenna Stern', 'Bellina Logan', 'Sean Patrick Thomas']",PG-13,1997.0,1h 41min,09-01-1998,United Kingdom,09-01-1998,United Kingdom,"Kate is working on a career at Mercer Advertising but is passed up for promotion because she's 'not stable enough', still being single and having no ties to the company. A story is made up about her being engaged to Nick, a guy whom she just met at a friend's wedding, and all seems to work out well for Kate. She even gets the attention of a colleague she had always wanted, but events soon take a dramatic turn, forcing her to 'present' her alleged fiance to her boss. —Malthus "
21,[7],506,Rebel Without a Cause (1955),"https://m.media-amazon.com/images/M/MV5BMTg2ODcxOTU1OV5BMl5BanBnXkFtZTgwNzA3ODI1MDE@._V1_QL75_UY281_CR0,0,190,281_.jpg 190w, https://m.media-amazon.com/images/M/MV5BMTg2ODcxOTU1OV5BMl5BanBnXkFtZTgwNzA3ODI1MDE@._V1_QL75_UY422_CR0,0,285,422_.jpg 285w, https://m.media-amazon.com/images/M/MV5BMTg2ODcxOTU1OV5BMl5BanBnXkFtZTgwNzA3ODI1MDE@._V1_QL75_UY562_CR0,0,380,562_.jpg 380w",http://www.imdb.com/title/tt0048545/?ref_=fn_al_tt_1,"A rebellious young man with a troubled past comes to a new town, finding friends and enemies.",7.7,87K,['Nicholas Ray'],"['Stewart Stern', 'Irving Shulman', 'Nicholas Ray']","['James Dean', 'Natalie Wood', 'Sal Mineo', 'Jim Backus', 'Ann Doran', 'Corey Allen', 'William Hopper', 'Rochelle Hudson', 'Dennis Hopper', 'Edward Platt', 'Steffi Sidney', 'Marietta Canty', 'Virginia Brissac', 'Beverly Long', 'Ian Wolfe', 'Frank Mazzola', 'Robert Foulk', 'Jack Simmons']",PG-13,1955.0,1h 51min,27-10-1955,United States,27-10-1955,United States,"Jim Stark is the new kid in town. He has been in trouble elsewhere; that's why his family has had to move before. Here he hopes to find the love he doesn't get from his middle-class family. Though he finds some of this in his relation with Judy, and a form of it in both Plato's adulation and Ray's real concern for him, Jim must still prove himself to his peers in switchblade knife fights and ""chickie"" games. —Ed Stephan "
22,[ 4 14],785,Only You (1994),"https://m.media-amazon.com/images/M/MV5BOTVkMmE1YWUtM2QwZi00OTJhLWIyYzMtOWQwNmI2MzE2NzE0XkEyXkFqcGdeQXVyNDAxNjkxNjQ@._V1_QL75_UX190_CR0,1,190,281_.jpg 190w, https://m.media-amazon.com/images/M/MV5BOTVkMmE1YWUtM2QwZi00OTJhLWIyYzMtOWQwNmI2MzE2NzE0XkEyXkFqcGdeQXVyNDAxNjkxNjQ@._V1_QL75_UX285_CR0,2,285,422_.jpg 285w, https://m.media-amazon.com/images/M/MV5BOTVkMmE1YWUtM2QwZi00OTJhLWIyYzMtOWQwNmI2MzE2NzE0XkEyXkFqcGdeQXVyNDAxNjkxNjQ@._V1_QL75_UX380_CR0,2,380,562_.jpg 380w",http://www.imdb.com/title/tt0110737/?ref_=fn_al_tt_1,"As a teen, Faith was told that her destiny is a man named Damon Bradley. Years later - Faith is about to marry another man - a Damon Bradley calls to wish them all the best. Faith blows off the wedding and follows Damon to Italy.",6.5,22K,['Norman Jewison'],['Diane Drake'],"['Marisa Tomei', 'Robert Downey Jr.', 'Bonnie Hunt', 'Joaquim de Almeida', 'Fisher Stevens', 'Billy Zane', 'Adam LeFevre', 'John Benjamin Hickey', 'Siobhan Fallon Hogan', 'Antonia Rey', 'Phyllis Newman', 'Denise Du Maurier', 'Tammy Minoff', 'Harry Barandes', 'Jessica Hertel', 'Rick Applegate', 'Marc Field', 'Bob Tracey']",PG,1994.0,1h 49min,27-01-1995,United Kingdom,27-01-1995,United Kingdom,"Destiny. Faith (Marisa Tomei) believes that two soulmates can be united if they find each other. From the Ouija board, she has found the name of her missing half, and it is D-A-M-O-N B-R-A-D-L-E-Y. Later, the fortuneteller at a carnival sees the name Damon Bradley in the Crystal Ball and Faith is convinced. She is told that ""You make your own destiny--don't wait for it to come to you"", but she is looking for Damon. 14 years later, she is engaged to a dull podiatrist--until she gets a call from one of his classmates who is on his way to Venice, Italy. The classmate is Damon Bradley. Rushing to the airport to see her soulmate, she misses him and the plane, but decides then and there to go after him, and she and her sister-in-law Kate board the next plane for Italy hoping to find her Damon. —Tony Fontana "
23,[ 0  1 15],449,Star Trek: The Motion Picture (1979),"https://m.media-amazon.com/images/M/MV5BNzNlMzNlNmQtNmYzNS00YmU5LWIzYWQtMDRkYzIzNzEzOTIyXkEyXkFqcGdeQXVyMTQxNzMzNDI@._V1_QL75_UX190_CR0,3,190,281_.jpg 190w, https://m.media-amazon.com/images/M/MV5BNzNlMzNlNmQtNmYzNS00YmU5LWIzYWQtMDRkYzIzNzEzOTIyXkEyXkFqcGdeQXVyMTQxNzMzNDI@._V1_QL75_UX285_CR0,4,285,422_.jpg 285w, https://m.media-amazon.com/images/M/MV5BNzNlMzNlNmQtNmYzNS00YmU5LWIzYWQtMDRkYzIzNzEzOTIyXkEyXkFqcGdeQXVyMTQxNzMzNDI@._V1_QL75_UX380_CR0,5,380,562_.jpg 380w",http://www.imdb.com/title/tt0079945/?ref_=fn_al_tt_1,"When an alien spacecraft of enormous power is spotted approaching Earth, Admiral James T. Kirk resumes command of the overhauled USS Enterprise in order to intercept it.",6.4,86K,['Robert Wise'],"['Gene Roddenberry', 'Harold Livingston', 'Alan Dean Foster']","['William Shatner', 'Leonard Nimoy', 'DeForest Kelley', 'James Doohan', 'George Takei', 'Majel Barrett', 'Walter Koenig', 'Nichelle Nichols', 'Persis Khambatta', 'Stephen Collins', 'Grace Lee Whitney', 'Mark Lenard', 'Billy Van Zandt', 'Roger Aaron Brown', 'Gary Faga', 'David Gautreaux', 'John Gowans', 'Howard Itzkowitz']",G,1979.0,2h 12min,15-12-1979,United Kingdom,15-12-1979,United Kingdom,"A massive alien spacecraft of enormous power destroys three powerful Klingon cruisers as it makes its way towards Federation space. Admiral James T. Kirk is ordered to take command of the USS Enterprise for the first time since her historic five-year mission. The Epsilon IX space station alerts the Federation, but they are also destroyed by the alien spacecraft. The only starship in range is the Enterprise, after undergoing a major overhaul in drydock orbiting Earth. Kirk rounds up the rest of his crew, and acquires some new members, and sets off to intercept the alien spacecraft. However, it has been three years since Kirk last went into deep space--is he up to the task of saving Earth? —Colin Tinto "
24,[10],666,Blood For Dracula (Andy Warhol's Dracula) (1974),"https://m.media-amazon.com/images/M/MV5BZGU2ZGJmODYtZWUwZS00NTcxLWE2ZGMtMWY1NzUxOGJiZTM0XkEyXkFqcGdeQXVyOTc5MDI5NjE@._V1_QL75_UX190_CR0,2,190,281_.jpg 190w, https://m.media-amazon.com/images/M/MV5BZGU2ZGJmODYtZWUwZS00NTcxLWE2ZGMtMWY1NzUxOGJiZTM0XkEyXkFqcGdeQXVyOTc5MDI5NjE@._V1_QL75_UX285_CR0,3,285,422_.jpg 285w, https://m.media-amazon.com/images/M/MV5BZGU2ZGJmODYtZWUwZS00NTcxLWE2ZGMtMWY1NzUxOGJiZTM0XkEyXkFqcGdeQXVyOTc5MDI5NjE@._V1_QL75_UX380_CR0,4,380,562_.jpg 380w",http://www.imdb.com/title/tt0071233/?ref_=fn_al_tt_1,An ailing vampire count travels to Italy with his servant to find a bride.,6.2,5.5K,['Paul Morrissey'],"['Paul Morrissey', 'Pat Hackett', 'Bram Stoker']","['Joe Dallesandro', 'Udo Kier', 'Vittorio De Sica', 'Maxime McKendry', 'Arno Jürging', 'Milena Vukotic', 'Dominique Darel', 'Stefania Casini', 'Silvia Dionisio', 'Inna Alexeievna', 'Gil Cagne', 'Emi Califri', 'Eleonora Zani', 'Giorgio Dolfin', 'Stefano Oppedisano', 'Roman Polanski']",R,1974.0,1h 46min,01-01-1975,United Kingdom,01-01-1975,United Kingdom,"Udo Kier is without a doubt the sickliest of vampires in any director's interpretation of the Bram Stoker tale. Count Dracula knows that if he fails to drink a required amount of pure virgin's [pronounced ""wirgin's""] blood, it's time to move into a permanent coffin. His assistant (Renfield?) suggests that the Count and he pick up his coffin and take a road trip to Italy, where families are known to be particularly religious, and therefore should be an excellent place to search for a virgin bride. They do, only to encounter a family with not one, but FOUR virgins, ready for marriage. The Count discovers one-by-one that the girls are not as pure as they say they are, meanwhile a handsome servant/Communist begins to observe strange behaviour from the girls who do spend the night with the Count. It's a race for Dracula to discover who's the real virgin, before he either dies from malnourishment or from the wooden stake of the Communist! —Jonathan Dakss "
25,[4],745,"Ruling Class, The (1972)","https://m.media-amazon.com/images/M/MV5BZmQyZDI5ZmItZGExNy00YzJmLWE3NmYtNTBiMjcwMWFkNzkxXkEyXkFqcGdeQXVyMjI4MjA5MzA@._V1_QL75_UX190_CR0,4,190,281_.jpg 190w, https://m.media-amazon.com/images/M/MV5BZmQyZDI5ZmItZGExNy00YzJmLWE3NmYtNTBiMjcwMWFkNzkxXkEyXkFqcGdeQXVyMjI4MjA5MzA@._V1_QL75_UX285_CR0,6,285,422_.jpg 285w, https://m.media-amazon.com/images/M/MV5BZmQyZDI5ZmItZGExNy00YzJmLWE3NmYtNTBiMjcwMWFkNzkxXkEyXkFqcGdeQXVyMjI4MjA5MzA@._V1_QL75_UX380_CR0,8,380,562_.jpg 380w",http://www.imdb.com/title/tt0069198/?ref_=fn_al_tt_1,"A member of the House of Lords dies, leaving his estate to his son. Unfortunately, his son thinks he is Jesus Christ. Their other, somewhat more respectable, family members plot to steal the estate from him; murder and mayhem ensue.",7.4,6.1K,['Peter Medak'],['Peter Barnes'],"[""Peter O'Toole"", 'Alastair Sim', 'Arthur Lowe', 'Hugh Owens', 'Harry Andrews', 'William Mervyn', 'Coral Browne', 'James Villiers', 'Hugh Burden', 'Michael Bryant', 'Henry Woolf', 'Griffith Davies', 'Oliver MacGreevy', 'Kay Walsh', 'Patsy Byrne', 'Carolyn Seymour', 'Neil Kennedy', 'Nigel Green']",PG,1972.0,2h 34min,25-05-1972,United Kingdom,25-05-1972,United Kingdom,"A member of the House of Lords dies in a shockingly silly way, leaving his estate to his son. Unfortunately, his son is insane: he thinks he is Jesus Christ. The other somewhat-more respectable members of their family plot to steal the estate from him; murder and mayhem ensue. —Mark Logan "
26,[ 0  1 19],562,"Quick and the Dead, The (1995)","https://m.media-amazon.com/images/M/MV5BMmRjOGVlNmMtMzgzOS00OGVjLWI5Y2MtYzdiOWIyZTFjM2M4XkEyXkFqcGdeQXVyNDEzNjMzNjk@._V1_QL75_UY281_CR93,0,190,281_.jpg 190w, https://m.media-amazon.com/images/M/MV5BMmRjOGVlNmMtMzgzOS00OGVjLWI5Y2MtYzdiOWIyZTFjM2M4XkEyXkFqcGdeQXVyNDEzNjMzNjk@._V1_QL75_UY422_CR139,0,285,422_.jpg 285w, https://m.media-amazon.com/images/M/MV5BMmRjOGVlNmMtMzgzOS00OGVjLWI5Y2MtYzdiOWIyZTFjM2M4XkEyXkFqcGdeQXVyNDEzNjMzNjk@._V1_QL75_UY562_CR185,0,380,562_.jpg 380w",http://www.imdb.com/title/tt7221904/?ref_=fn_al_tt_1,MrSheltonTV takes a look at The Quick and the Dead (1995).,,,['John H. Shelton'],['John H. Shelton'],['John H. Shelton'],,,,28-06-2014,United Kingdom,28-06-2014,United Kingdom,MrSheltonTV takes a look at The Quick and the Dead (1995).
27,[4],995,"Kiss Me, Guido (1997)","https://m.media-amazon.com/images/M/MV5BMzMyNTE4Mjk4MF5BMl5BanBnXkFtZTcwNTMwMjEyMQ@@._V1_QL75_UY281_CR3,0,190,281_.jpg 190w, https://m.media-amazon.com/images/M/MV5BMzMyNTE4Mjk4MF5BMl5BanBnXkFtZTcwNTMwMjEyMQ@@._V1_QL75_UY422_CR5,0,285,422_.jpg 285w, https://m.media-amazon.com/images/M/MV5BMzMyNTE4Mjk4MF5BMl5BanBnXkFtZTcwNTMwMjEyMQ@@._V1_QL75_UY562_CR7,0,380,562_.jpg 380w",http://www.imdb.com/title/tt0119465/?ref_=fn_al_tt_1,"Warren has an extra room in his apartment (and is five months behind on the rent) after his lover moves out, so a friend places an ad on his behalf for a GWM roommate. Frankie, a pizza baker (and aspiring actor), decides to move out of his family's flat in The Bronx when he comes home one evening and walks in on his brother making love to Frankie's girlfriend. Frankie checks ads for roommates in ""the city"" (i.e., Manhattan), notices Warren's ad and decides to answer it, reasoning that GWM stands for ""Guy With Money.""",6.1,2K,['Tony Vitale'],['Tony Vitale'],"['Nick Scotti', 'Anthony Barrile', 'Anthony DeSando', 'Craig Chester', 'Domenick Lombardozzi', 'Molly Price', 'Christopher Lawford', 'David Deblinger', 'John Tormey', 'Antonia Rey', 'Jennifer Esposito', 'Anthony Vitale', 'Frankie Dellarosa', 'Rebecca Waxman', 'Tony Ray Rossi', 'Dwight Ewell', 'Marcia Firesten', 'Bryan Batt']",R,1997.0,1h 26min,19-12-1997,United Kingdom,19-12-1997,United Kingdom,"Warren has an extra room in his apartment (and is five months behind on the rent) after his lover moves out, so a friend places an ad on his behalf for a GWM roommate. Frankie, a pizza baker (and aspiring actor), decides to move out of his family's flat in The Bronx when he comes home one evening and walks in on his brother making love to Frankie's girlfriend. Frankie checks ads for roommates in ""the city"" (i.e., Manhattan), notices Warren's ad and decides to answer it, reasoning that GWM stands for ""Guy With Money."" —Dennis Lewis "
28,[7],58,Quiz Show (1994),"https://m.media-amazon.com/images/M/MV5BNTYxNjdjMzUtYzAyNC00NWJhLWFlM2EtNWM4NDBhZmQ1YjJiXkEyXkFqcGdeQXVyNDk3NzU2MTQ@._V1_QL75_UY281_CR1,0,190,281_.jpg 190w, https://m.media-amazon.com/images/M/MV5BNTYxNjdjMzUtYzAyNC00NWJhLWFlM2EtNWM4NDBhZmQ1YjJiXkEyXkFqcGdeQXVyNDk3NzU2MTQ@._V1_QL75_UY422_CR0,0,285,422_.jpg 285w, https://m.media-amazon.com/images/M/MV5BNTYxNjdjMzUtYzAyNC00NWJhLWFlM2EtNWM4NDBhZmQ1YjJiXkEyXkFqcGdeQXVyNDk3NzU2MTQ@._V1_QL75_UY562_CR1,0,380,562_.jpg 380w",http://www.imdb.com/title/tt0110932/?ref_=fn_al_tt_1,"A young lawyer, Richard Goodwin, investigates a potentially fixed game show. Charles Van Doren, a big time show winner, is under Goodwin's investigation.",7.5,67K,['Robert Redford'],"['Paul Attanasio', 'Richard N. Goodwin']","['Ralph Fiennes', 'John Turturro', 'Rob Morrow', 'Paul Scofield', 'David Paymer', 'Hank Azaria', 'Christopher McDonald', 'Johann Carlo', 'Elizabeth Wilson', 'Allan Rich', 'Mira Sorvino', 'George Martin', 'Paul Guilfoyle', 'Griffin Dunne', 'Michael Mantell', 'Byron Jennings', 'Ben Shenkman', 'Timothy Busfield']",PG-13,1994.0,2h 13min,17-03-1995,United Kingdom,17-03-1995,United Kingdom,"An idealistic young lawyer working for a Congressional subcommittee in the late 1950s discovers that TV quiz shows are being fixed. His investigation focuses on two contestants on the show ""Twenty-One"": Herbert Stempel, a brash working-class Jew from Queens, and Charles Van Doren, the patrician scion of one of America's leading literary families. Based on a true story. —Tim Horrigan "
