,movie_genres,movie_id,movie_title,poster_url,movie_url,description,rating,num_review,director,writer,cast,age_rating,year,movie_length,release_date_x,country_x,release_date_y,country_y,storyline
28,[4 7],1241,"Van, The (1996)","https://m.media-amazon.com/images/M/MV5BNzMxMDc4OGItODBiZi00NjYyLThiMzctMzQwZjgzYWE0MzQzXkEyXkFqcGdeQXVyNTUyMzE4Mzg@._V1_QL75_UX190_CR0,0,190,281_.jpg 190w, https://m.media-amazon.com/images/M/MV5BNzMxMDc4OGItODBiZi00NjYyLThiMzctMzQwZjgzYWE0MzQzXkEyXkFqcGdeQXVyNTUyMzE4Mzg@._V1_QL75_UX285_CR0,1,285,422_.jpg 285w, https://m.media-amazon.com/images/M/MV5BNzMxMDc4OGItODBiZi00NjYyLThiMzctMzQwZjgzYWE0MzQzXkEyXkFqcGdeQXVyNTUyMzE4Mzg@._V1_QL75_UX380_CR0,1,380,562_.jpg 380w",http://www.imdb.com/title/tt0116583/?ref_=fn_al_tt_1,"A deformed bell-ringer must assert his independence from a vicious government minister in order to help his friend, a gypsy dancer.",7.0,149K,"['Gary Trousdale', 'Kirk Wise']","['Tab Murphy', 'Victor Hugo', 'Irene Mecchi']","['Demi Moore', 'Jason Alexander', 'Mary Kay Bergman', 'Corey Burton', 'Jim Cummings', 'Bill Fagerbakke', 'Tom Hulce', 'Tony Jay', 'Paul Kandel', 'Charles Kimbrough', 'Kevin Kline', 'Heidi Mollenhauer', 'Patrick Pinney', 'Gary Trousdale', 'David Ogden Stiers', 'Frank Welker', 'Mary Wickes', 'Jane Withers']",G,1996.0,1h 31min,19-07-1996,United Kingdom,19-07-1996,United Kingdom,"In 15th-century Paris, Clopin the puppeteer tells the story of Quasimodo, the misshapen but gentle-souled bell ringer of Notre Dame, who was nearly killed as a baby by Claude Frollo, the Minister of Justice. But Frollo was forced by the Archdeacon of Notre Dame to raise Quasimodo as his own. Now a young man, Quasimodo is hidden from the world by Frollo in the belltower of the cathedral. But during the Festival of Fools, Quasimodo, cheered on by his gargoyle friends Victor, Hugo, and Laverne, decides to take part in the festivities, where he meets the lovely gypsy girl Esmeralda and the handsome soldier Phoebus. The three of them find themselves ranged against Frollo's cruelty and his attempts to destroy the home of the gypsies, the Court of Miracles. And Quasimodo must desperately defend both Esmeralda and the very cathedral of Notre Dame. —Kathy Li"
29,[ 0 10 15 16],183,Alien (1979),"https://m.media-amazon.com/images/M/MV5BMmQ2MmU3NzktZjAxOC00ZDZhLTk4YzEtMDMyMzcxY2IwMDAyXkEyXkFqcGdeQXVyNzkwMjQ5NzM@._V1_QL75_UY281_CR1,0,190,281_.jpg 190w, https://m.media-amazon.com/images/M/MV5BMmQ2MmU3NzktZjAxOC00ZDZhLTk4YzEtMDMyMzcxY2IwMDAyXkEyXkFqcGdeQXVyNzkwMjQ5NzM@._V1_QL75_UY422_CR1,0,285,422_.jpg 285w, https://m.media-amazon.com/images/M/MV5BMmQ2MmU3NzktZjAxOC00ZDZhLTk4YzEtMDMyMzcxY2IwMDAyXkEyXkFqcGdeQXVyNzkwMjQ5NzM@._V1_QL75_UY562_CR1,0,380,562_.jpg 380w",http://www.imdb.com/title/tt0078748/?ref_=fn_al_tt_1,"After a space merchant vessel receives an unknown transmission as a distress call, one of the crew is attacked by a mysterious life form and they soon realize that its life cycle has merely begun.",8.4,826K,['Ridley Scott'],"[""Dan O'Bannon"", 'Ronald Shusett']","['Sigourney Weaver', 'Tom Skerritt', 'John Hurt', 'Veronica Cartwright', 'Harry Dean Stanton', 'Ian Holm', 'Yaphet Kotto', 'Bolaji Badejo', 'Helen Horton', 'Eddie Powell']",R,1979.0,1h 57min,06-09-1979,United Kingdom,06-09-1979,United Kingdom,"In the distant future, the commercial spaceship ""Nostromo"" crew is on its way home when the crew picks up a distress call from a distant moon. The crew must investigate, and the spaceship descends on the small planetoid afterwards. After a rough landing, three crew members leave the spaceship to explore the area on the planetoid. At the same time, the ship's computer deciphers the message. When the crew realizes it is not alone on the spaceship, they must deal with the consequences. —blazesnakes9"
30,[4],1609,B*A*P*S (1997),"https://m.media-amazon.com/images/M/MV5BYTMxY2ZjZmQtZTc1MC00ZTBhLTg1MTQtNjhmODQ1OWE4NjBjXkEyXkFqcGdeQXVyNzc5MjA3OA@@._V1_QL75_UX190_CR0,6,190,281_.jpg 190w, https://m.media-amazon.com/images/M/MV5BYTMxY2ZjZmQtZTc1MC00ZTBhLTg1MTQtNjhmODQ1OWE4NjBjXkEyXkFqcGdeQXVyNzc5MjA3OA@@._V1_QL75_UX285_CR0,9,285,422_.jpg 285w, https://m.media-amazon.com/images/M/MV5BYTMxY2ZjZmQtZTc1MC00ZTBhLTg1MTQtNjhmODQ1OWE4NjBjXkEyXkFqcGdeQXVyNzc5MjA3OA@@._V1_QL75_UX380_CR0,11,380,562_.jpg 380w",http://www.imdb.com/title/tt0118663/?ref_=fn_al_tt_1,Two tacky homegirls move to L.A. to become dancers; instead they scam a dying millionaire but eventually become B*A*P*S (Black American Princesses).,4.7,5.3K,['Robert Townsend'],['Troy Byer'],"['Halle Berry', 'Natalie Desselle Reid', 'Martin Landau', 'Ian Richardson', 'Troy Byer', 'Luigi Amodeo', 'Jonathan Fried', 'Pierre Edwards', 'Anthony Johnson', 'Bernie Mac', 'Darrel Heath', 'Vincent Cook', 'Faizon Love', 'Rudy Ray Moore', 'Darrow Igus', 'Debra Wilson', 'Robin Van Sharner', 'Jessica Page']",PG-13,1997.0,1h 31min,01-08-1997,United Kingdom,01-08-1997,United Kingdom,"Nisi and Mickey are girlfriends who work as waitresses. To get the necessary money for opening their dream restaurant they fly to California to audition for a music video. There Nisi is asked by the nephew of Mr.Blakemore's (who is video director) to act for a week as granddaughter of Lily, Mr.Blakemores one true love, whom he lost long ago and couldn't pursue because she was his family's housekeeper. They revive Blakemore's interest for life, and he teaches them to be ""Black American Princesses"" in return. —Anonymous"
31,[ 4 14],1655,"Favor, The (1994)","https://m.media-amazon.com/images/M/MV5BMmE3ZGE4MzUtMzNjYS00NzBkLWEzOGEtMDk5NTcwOWRiZWJiXkEyXkFqcGdeQXVyMzEzNTQ2OA@@._V1_QL75_UX140_CR0,12,140,140_.jpg 140w, https://m.media-amazon.com/images/M/MV5BMmE3ZGE4MzUtMzNjYS00NzBkLWEzOGEtMDk5NTcwOWRiZWJiXkEyXkFqcGdeQXVyMzEzNTQ2OA@@._V1_QL75_UX210_CR0,18,210,210_.jpg 210w, https://m.media-amazon.com/images/M/MV5BMmE3ZGE4MzUtMzNjYS00NzBkLWEzOGEtMDk5NTcwOWRiZWJiXkEyXkFqcGdeQXVyMzEzNTQ2OA@@._V1_QL75_UX280_CR0,24,280,280_.jpg 280w",http://www.imdb.com/title/tt4478446/?ref_=fn_al_tt_1,"It looks like we don't have any Plot Summaries for this title yet.
Be the first to contribute! Just click the ""Edit page"" button at the bottom of the page or learn more in the Plot Summary submission guide.",,,"['Reno Wilson', 'Rick Yaeger']","['', '']","['Reno Wilson', 'Rick Yaeger']",,,,13-11-2014,Canada,13-11-2014,Canada,
32,[ 2  3 12],989,Cats Don't Dance (1997),"https://m.media-amazon.com/images/M/MV5BYjEyNmY0NDItOGZiMS00NjE2LTg5OTItNTRjMzZjMjI5OTUxXkEyXkFqcGdeQXVyNzc5MjA3OA@@._V1_QL75_UY281_CR1,0,190,281_.jpg 190w, https://m.media-amazon.com/images/M/MV5BYjEyNmY0NDItOGZiMS00NjE2LTg5OTItNTRjMzZjMjI5OTUxXkEyXkFqcGdeQXVyNzc5MjA3OA@@._V1_QL75_UY422_CR1,0,285,422_.jpg 285w, https://m.media-amazon.com/images/M/MV5BYjEyNmY0NDItOGZiMS00NjE2LTg5OTItNTRjMzZjMjI5OTUxXkEyXkFqcGdeQXVyNzc5MjA3OA@@._V1_QL75_UY562_CR2,0,380,562_.jpg 380w",http://www.imdb.com/title/tt0118829/?ref_=fn_al_tt_1,"Danny, an ambitious singing and dancing cat, goes to Hollywood and overcomes several obstacles to fulfill his dream of becoming a movie star.",6.9,7.4K,['Mark Dindal'],"['Mark Dindal', 'Robert Lence', 'Brian McEntee']","['Scott Bakula', 'Jasmine Guy', 'Natalie Cole', 'Ashley Peldon', 'Lindsay Ridgeway', 'Kathy Najimy', 'John Rhys-Davies', 'George Kennedy', 'Rene Auberjonois', 'Betty Lou Gerson', 'Hal Holbrook', 'Matthew Herried', 'Don Knotts', 'Rick Logan', 'Frank Welker', 'David Johansen', 'Mark Dindal', 'Vanessa Theme Ament']",G,1997.0,1h 15min,18-06-1999,United Kingdom,18-06-1999,United Kingdom,"Danny is a cat leaving his small town home for the big time in Hollywood. He comes in hoping to sing and dance his way into stardom, not knowing that animals can only be extras, and if he forgets his place, child starlet Darla Dimple and her musclehead butler Max have ways of reminding him. —Thomas Pluck "
33,[ 0 16],128,Supercop (1992),"https://m.media-amazon.com/images/M/MV5BNWJiMzMzMjAtNmIxZi00Yjk3LWFlYmItNzNiMGZmYjE0NWJlXkEyXkFqcGdeQXVyNTAyODkwOQ@@._V1_QL75_UX190_CR0,2,190,281_.jpg 190w, https://m.media-amazon.com/images/M/MV5BNWJiMzMzMjAtNmIxZi00Yjk3LWFlYmItNzNiMGZmYjE0NWJlXkEyXkFqcGdeQXVyNTAyODkwOQ@@._V1_QL75_UX285_CR0,3,285,422_.jpg 285w, https://m.media-amazon.com/images/M/MV5BNWJiMzMzMjAtNmIxZi00Yjk3LWFlYmItNzNiMGZmYjE0NWJlXkEyXkFqcGdeQXVyNTAyODkwOQ@@._V1_QL75_UX380_CR0,4,380,562_.jpg 380w",http://www.imdb.com/title/tt0104558/?ref_=fn_al_tt_1,A Hong Kong detective teams up with his female Red Chinese counterpart to stop a Chinese drug czar.,6.9,21K,['Stanley Tong'],"['Edward Tang', 'Fibe Ma', 'Lee Wai Yee']","['Jackie Chan', 'Michelle Yeoh', 'Maggie Cheung', 'Kenneth Tsang', 'Wah Yuen', 'Bill Tung', 'Josephine Koo', 'Kelvin Wong', 'Philip Chan', 'Ken Lo', 'Lieh Lo', 'Wai Shum', 'Yi-Sheng Han', 'Sze Tsuen Wai', 'Wai-Lun Tuan', 'Wong Yue Man', 'Chi-Ming Lau', 'Wai-Man Tam']",R,1992.0,1h 31min,04-07-1992,Hong Kong,04-07-1992,Hong Kong,"A Hong Kong police officer, Ka Kui is sent undercover to mainland China to break up a drug smuggling ring. After breaking the brother of the drug lord out of prison, he and another agent (a beautiful communist policewoman) are taken to Hong Kong to work for the syndicate. The wife of the crime boss has been arrested in Malaysia for drug trafficking and is soon to be executed. However, she is the only person who knows the account number of a secret Swiss bank account containing millions in drug money. While the two officers are in Malaysia preparing for the jail break, Ka Kui accidentally runs into his girlfriend May, who has traveled there from Hong Kong. Soon his cover is blown, the criminals kidnap his girlfriend and he is forced to help them pull off the jail break. —YO "
34,[4],1270,Life with Mikey (1993),"https://m.media-amazon.com/images/M/MV5BYTY3YTcxODktYTBlZC00MzQ1LWE4ZDUtZDQwYTZlMDUzOWExXkEyXkFqcGdeQXVyNjMwMjk0MTQ@._V1_QL75_UX190_CR0,6,190,281_.jpg 190w, https://m.media-amazon.com/images/M/MV5BYTY3YTcxODktYTBlZC00MzQ1LWE4ZDUtZDQwYTZlMDUzOWExXkEyXkFqcGdeQXVyNjMwMjk0MTQ@._V1_QL75_UX285_CR0,9,285,422_.jpg 285w, https://m.media-amazon.com/images/M/MV5BYTY3YTcxODktYTBlZC00MzQ1LWE4ZDUtZDQwYTZlMDUzOWExXkEyXkFqcGdeQXVyNjMwMjk0MTQ@._V1_QL75_UX380_CR0,11,380,562_.jpg 380w",http://www.imdb.com/title/tt0107413/?ref_=fn_al_tt_1,A once-popular actor who now runs a talent agency specializing in child acts is trying to discover the next star. He gets more than he bargained for when he recruits a child pickpocket.,5.6,5.8K,['James Lapine'],['Marc Lawrence'],"['Michael J. Fox', 'Christina Vidal', 'Nathan Lane', 'Cyndi Lauper', 'David Krumholtz', 'David Huddleston', 'Victor Garber', 'Frances Chaney', 'Kathryn Grody', 'Mary Alice', 'Annabelle Gurwitch', 'Kathleen McNenny', 'Jonathan C. Kaplan', 'Tony Hendra', 'Mario Todisco', 'Michael Rupert', 'Christine Baranski', 'Sean Power']",PG,1993.0,1h 31min,04-06-1993,United States,04-06-1993,United States,"Michael Chapman was once a child television star. But when he grew up, he couldn't get work. So he and his brother, Ed start their own talent agency that specializes in child acts. They can't seem to find the next big thing, and they have to deal with another agency who's not above bribery to get the kids to sign with them. One day, Michael meets a girl named Angie and she's a real spitfire. Michael thinks she could be what they are looking for. Problem is, is that she has a big chip on her shoulder. —rcs0411@yahoo.com"
35,[7],529,My Life as a Dog (Mitt liv som hund) (1985),"https://m.media-amazon.com/images/M/MV5BY2JhOGI1MGItNzFiNC00NzcxLThiMTMtMmVmYTlkZDA4MmYxXkEyXkFqcGdeQXVyOTc5MDI5NjE@._V1_QL75_UY281_CR2,0,190,281_.jpg 190w, https://m.media-amazon.com/images/M/MV5BY2JhOGI1MGItNzFiNC00NzcxLThiMTMtMmVmYTlkZDA4MmYxXkEyXkFqcGdeQXVyOTc5MDI5NjE@._V1_QL75_UY422_CR2,0,285,422_.jpg 285w, https://m.media-amazon.com/images/M/MV5BY2JhOGI1MGItNzFiNC00NzcxLThiMTMtMmVmYTlkZDA4MmYxXkEyXkFqcGdeQXVyOTc5MDI5NjE@._V1_QL75_UY562_CR3,0,380,562_.jpg 380w",http://www.imdb.com/title/tt0089606/?ref_=fn_al_tt_1,"A boy and his brother don't get along well. In order to let their ill mother rest, they're separated and sent each one with their relatives.",7.6,20K,['Lasse Hallström'],"['Reidar Jönsson', 'Lasse Hallström', 'Brasse Brännström']","['Anton Glanzelius', 'Tomas von Brömssen', 'Anki Lidén', 'Melinda Kinnaman', 'Kicki Rundgren', 'Lennart Hjulström', 'Ing-Marie Carlsson', 'Leif Ericson', 'Christina Carlwind', 'Ralph Carlsson', 'Viveca Dahlén', 'Arnold Alfredsson', 'Fritz Elofsson', 'Didrik Gustafsson', 'Jan-Philip Hollström', 'Vivi Johansson', 'Per Ottosson', 'Magnus Rask']",Unrated,1985.0,1h 41min,12-12-1985,Sweden,12-12-1985,Sweden,"Small town Sweden, in the 1950s. This slice-of-life story is also a coming-of-age tale narrated by a young boy with an almost unconscious sense of irony. His single mother is terminally ill, his older brother isn't the warmest person in his life, and twice he is sent to relatives in a supportive, loving village with interesting characters and adventures."
36,[4],1622,"Paris, France (1993)","https://m.media-amazon.com/images/M/MV5BMTgyNzk4Mjk3Nl5BMl5BanBnXkFtZTcwNzIzNjcyMQ@@._V1_QL75_UY281_CR4,0,190,281_.jpg 190w, https://m.media-amazon.com/images/M/MV5BMTgyNzk4Mjk3Nl5BMl5BanBnXkFtZTcwNzIzNjcyMQ@@._V1_QL75_UY422_CR6,0,285,422_.jpg 285w, https://m.media-amazon.com/images/M/MV5BMTgyNzk4Mjk3Nl5BMl5BanBnXkFtZTcwNzIzNjcyMQ@@._V1_QL75_UY562_CR9,0,380,562_.jpg 380w",http://www.imdb.com/title/tt0107779/?ref_=fn_al_tt_1,"Lucy (Leslie Hope), her husband Michael (Victor Ertmanis), and their business partner William (Dan Left) are the owners of a small publishing company in Toronto. The stability of their lives are thrown into an emotional maelstrom with the arrival of Sloan (Peter Outerbrige), a former boxer-turned-writer whose first book (based on a serial killer) is about to be published by their company. Sloan gets in over his head when he embarks on a steamy affair with the sexually ravenous and frustrated Lucy, who longs to re-create her S&M-filled days in Paris gone by. But Sloan soon embarks on another affair of his own with the openly gay William which leads to sexual confusion for the writer. All in the while, Lucy's befuddled husband, Michael, slowly goes crazy over learning of his wife and business partner's dalliance with his client until he decides to join in on their bed-jumping as well.",5.1,479,['Jerry Ciccoritti'],['Tom Walmsley'],"['Leslie Hope', 'Peter Outerbridge', 'Victor Ertmanis', 'Dan Lett', 'Raoul Max Trujillo', 'Patricia Ciccoritti']",NC-17,1993.0,1h 52min,22-07-1994,United Kingdom,22-07-1994,United Kingdom,"Lucy (Leslie Hope), her husband Michael (Victor Ertmanis), and their business partner William (Dan Left) are the owners of a small publishing company in Toronto. The stability of their lives are thrown into an emotional maelstrom with the arrival of Sloan (Peter Outerbrige), a former boxer-turned-writer whose first book (based on a serial killer) is about to be published by their company. Sloan gets in over his head when he embarks on a steamy affair with the sexually ravenous and frustrated Lucy, who longs to re-create her S&M-filled days in Paris gone by. But Sloan soon embarks on another affair of his own with the openly gay William which leads to sexual confusion for the writer. All in the while, Lucy's befuddled husband, Michael, slowly goes crazy over learning of his wife and business partner's dalliance with his client until he decides to join in on their bed-jumping as well. —Larry B."
37,[4],1288,Denise Calls Up (1995),"https://m.media-amazon.com/images/M/MV5BMTM5MTM1NjIxNV5BMl5BanBnXkFtZTcwMTc5OTkxMQ@@._V1_QL75_UX190_CR0,28,190,281_.jpg 190w, https://m.media-amazon.com/images/M/MV5BMTM5MTM1NjIxNV5BMl5BanBnXkFtZTcwMTc5OTkxMQ@@._V1_QL75_UX285_CR0,42,285,422_.jpg 285w, https://m.media-amazon.com/images/M/MV5BMTM5MTM1NjIxNV5BMl5BanBnXkFtZTcwMTc5OTkxMQ@@._V1_QL75_UX380_CR0,56,380,562_.jpg 380w",http://www.imdb.com/title/tt0112844/?ref_=fn_al_tt_1,"A group of friends in New York, working away at their PCs and laptops, keep in touch exclusively by phone and fax; all are too busy to meet face-to-face. By phone, Gale plays matchmaker for Jerry and Barbara who hit it off beautifully--via phone and fax. Martin gets a telephone call from somebody he has never met: it's Denise, and she has extraordinary news. Tapping away at his computer, he develops a sort of telephonic friendship with Denise. And so it goes as the friends tap, tap, tap away, sharing news, hopes, and dreams--via phone and fax. Finally Gale has an unfortunate encounter with a phone, Denise has more news for Martin, and Frank plans a gala New Year's Eve party--but will he answer the door?",6.6,1.3K,['Hal Salwen'],['Hal Salwen'],"['Tim Daly', 'Caroleen Feeney', 'Dan Gunther', 'Dana Wheeler-Nicholson', 'Liev Schreiber', 'Aida Turturro', 'Alanna Ubach', 'Sylvia Miles', 'Mark Blum', 'Jean-Claude La Marre', 'Hal Salwen']",PG-13,1995.0,1h 20min,26-07-1996,United Kingdom,26-07-1996,United Kingdom,"A group of friends in New York, working away at their PCs and laptops, keep in touch exclusively by phone and fax; all are too busy to meet face-to-face. By phone, Gale plays matchmaker for Jerry and Barbara who hit it off beautifully--via phone and fax. Martin gets a telephone call from somebody he has never met: it's Denise, and she has extraordinary news. Tapping away at his computer, he develops a sort of telephonic friendship with Denise. And so it goes as the friends tap, tap, tap away, sharing news, hopes, and dreams--via phone and fax. Finally Gale has an unfortunate encounter with a phone, Denise has more news for Martin, and Frank plans a gala New Year's Eve party--but will he answer the door? —Helen Stavrou "
38,[7],693,Casino (1995),"https://m.media-amazon.com/images/M/MV5BMTcxOWYzNDYtYmM4YS00N2NkLTk0NTAtNjg1ODgwZjAxYzI3XkEyXkFqcGdeQXVyNTA4NzY1MzY@._V1_QL75_UX190_CR0,2,190,281_.jpg 190w, https://m.media-amazon.com/images/M/MV5BMTcxOWYzNDYtYmM4YS00N2NkLTk0NTAtNjg1ODgwZjAxYzI3XkEyXkFqcGdeQXVyNTA4NzY1MzY@._V1_QL75_UX285_CR0,3,285,422_.jpg 285w, https://m.media-amazon.com/images/M/MV5BMTcxOWYzNDYtYmM4YS00N2NkLTk0NTAtNjg1ODgwZjAxYzI3XkEyXkFqcGdeQXVyNTA4NzY1MzY@._V1_QL75_UX380_CR0,4,380,562_.jpg 380w",http://www.imdb.com/title/tt0112641/?ref_=fn_al_tt_1,"A tale of greed, deception, money, power, and murder occur between two best friends: a mafia enforcer and a casino executive compete against each other over a gambling empire, and over a fast-living and fast-loving socialite.",8.2,490K,['Martin Scorsese'],"['Nicholas Pileggi', 'Martin Scorsese']","['Robert De Niro', 'Sharon Stone', 'Joe Pesci', 'James Woods', 'Don Rickles', 'Alan King', 'Kevin Pollak', 'L.Q. Jones', 'Dick Smothers', 'Frank Vincent', 'John Bloom', 'Pasquale Cajano', 'Melissa Prophet', 'Bill Allison', 'Vinny Vella', 'Philip Suriano', 'Erika von Tagen', 'Frankie Avalon']",R,1995.0,2h 58min,23-02-1996,United Kingdom,23-02-1996,United Kingdom,"This Martin Scorsese film depicts the Janus-like quality of Las Vegas: it has a glittering, glamorous face, as well as a brutal, cruel one. Ace Rothstein and Nicky Santoro, mobsters who move to Las Vegas to make their mark, live and work in this paradoxical world. Seen through their eyes, each as a foil to the other, the details of mob involvement in the casinos of the 1970s and '80s are revealed. Ace is the smooth operator of the Tangiers casino, while Nicky is his boyhood friend and tough strongman, robbing and shaking down the locals. However, they each have a tragic flaw: Ace falls in love with hustler Ginger, and Nicky falls into an ever-deepening spiral of drugs and violence. —Tad Dibbern "
39,[12],143,"Sound of Music, The (1965)","https://m.media-amazon.com/images/M/MV5BODIxNjhkYjEtYzUyMi00YTNjLWE1YjktNjAyY2I2MWNkNmNmL2ltYWdlL2ltYWdlXkEyXkFqcGdeQXVyMTQxNzMzNDI@._V1_QL75_UY281_CR4,0,190,281_.jpg 190w, https://m.media-amazon.com/images/M/MV5BODIxNjhkYjEtYzUyMi00YTNjLWE1YjktNjAyY2I2MWNkNmNmL2ltYWdlL2ltYWdlXkEyXkFqcGdeQXVyMTQxNzMzNDI@._V1_QL75_UY422_CR6,0,285,422_.jpg 285w, https://m.media-amazon.com/images/M/MV5BODIxNjhkYjEtYzUyMi00YTNjLWE1YjktNjAyY2I2MWNkNmNmL2ltYWdlL2ltYWdlXkEyXkFqcGdeQXVyMTQxNzMzNDI@._V1_QL75_UY562_CR9,0,380,562_.jpg 380w",http://www.imdb.com/title/tt0059742/?ref_=fn_al_tt_1,A woman leaves an Austrian convent to become a governess to a Naval officer widower's children.,8.0,217K,['Robert Wise'],"['George Hurdalek', 'Howard Lindsay', 'Russel Crouse']","['Julie Andrews', 'Christopher Plummer', 'Eleanor Parker', 'Richard Haydn', 'Peggy Wood', 'Charmian Carr', 'Heather Menzies-Urich', 'Nicholas Hammond', 'Duane Chase', 'Angela Cartwright', 'Debbie Turner', 'Kym Karath', 'Anna Lee', 'Portia Nelson', 'Ben Wright', 'Daniel Truhitte', 'Norma Varden', 'Gilchrist Stuart']",G,1965.0,2h 52min,29-03-1965,United Kingdom,29-03-1965,United Kingdom,"In 1930s Austria, a young woman named Maria is failing miserably in her attempts to become a nun. When Navy Captain Georg Von Trapp writes to the abbey asking for a governess that can handle his seven mischievous children, Maria is given the job. His wife is dead, he is often away, and he runs the household as strictly as he does the ships he sails on. The children are unhappy and resentful of the governesses that he keeps hiring and have managed to run each of them off one by one. When Maria arrives, she is initially met with the same hostility, but her kindness, understanding, and sense of fun soon draws the children to her and brings some much-needed joy into all their lives, including the Captain's. Eventually he and Maria find themselves falling in love, even though he is already engaged to a Baroness named Elsa and Maria is still a postulant. The romance makes them both start questioning the decisions they have made. Their personal conflicts soon become overshadowed, however, by world events. Austria is about to come under Germany's control, and the Captain may soon find himself drafted into the German Navy and forced to fight against his own country."
40,[5 7],346,Jackie Brown (1997),"https://m.media-amazon.com/images/M/MV5BNmY5ODRmYTItNWU0Ni00MWE3LTgyYzUtYjZlN2Q5YTcyM2NmXkEyXkFqcGdeQXVyNjU0OTQ0OTY@._V1_QL75_UY281_CR1,0,190,281_.jpg 190w, https://m.media-amazon.com/images/M/MV5BNmY5ODRmYTItNWU0Ni00MWE3LTgyYzUtYjZlN2Q5YTcyM2NmXkEyXkFqcGdeQXVyNjU0OTQ0OTY@._V1_QL75_UY422_CR2,0,285,422_.jpg 285w, https://m.media-amazon.com/images/M/MV5BNmY5ODRmYTItNWU0Ni00MWE3LTgyYzUtYjZlN2Q5YTcyM2NmXkEyXkFqcGdeQXVyNjU0OTQ0OTY@._V1_QL75_UY562_CR2,0,380,562_.jpg 380w",http://www.imdb.com/title/tt0119396/?ref_=fn_al_tt_1,"A flight attendant with a criminal past gets nabbed by the FBI for smuggling. Under pressure to become an informant against the drug dealer she works for, she must find a way to secure her future without getting killed.",7.5,332K,['Quentin Tarantino'],"['Quentin Tarantino', 'Elmore Leonard']","['Pam Grier', 'Samuel L. Jackson', 'Robert Forster', 'Bridget Fonda', 'Michael Keaton', 'Robert De Niro', 'Michael Bowen', 'Chris Tucker', 'LisaGay Hamilton', 'Tom Lister Jr.', 'Hattie Winston', 'Sid Haig', 'Aimee Graham', 'Ellis Williams', 'Tangie Ambrose', ""T'Keyah Crystal Keymáh"", 'Venessia Valentino', 'Diana Uribe']",R,1997.0,2h 34min,10-04-1998,United Kingdom,10-04-1998,United Kingdom,"The middle-aged stewardess Jackie Brown smuggles money from Mexico to Los Angeles for the arms dealer Ordell Robbie. When she gets caught by the agents Ray Nicolet and Mark Dargus with ten thousand dollars and cocaine in her purse, they propose a deal to her to help them to arrest Ordell in exchange of her freedom. Meanwhile Ordell asks the 56-year-old Max Cherry, who runs a bail bond business, to release Jackie Brown with the intention of eliminating her. Jackie suspects of Ordell's intention and plots a complicated confidence game with Max to steal half a million dollars from Ordell. —Claudio Carvalho, Rio de Janeiro, Brazil"
