,movie_genres,movie_id,movie_title,poster_url,movie_url,description,rating,num_review,director,writer,cast,age_rating,year,movie_length,release_date_x,country_x,release_date_y,country_y,storyline
14,[0 1 5],254,Batman & Robin (1997),"https://m.media-amazon.com/images/M/MV5BMGQ5YTM1NmMtYmIxYy00N2VmLWJhZTYtN2EwYTY3MWFhOTczXkEyXkFqcGdeQXVyNTA2NTI0MTY@._V1_QL75_UX190_CR0,1,190,281_.jpg 190w, https://m.media-amazon.com/images/M/MV5BMGQ5YTM1NmMtYmIxYy00N2VmLWJhZTYtN2EwYTY3MWFhOTczXkEyXkFqcGdeQXVyNTA2NTI0MTY@._V1_QL75_UX285_CR0,1,285,422_.jpg 285w, https://m.media-amazon.com/images/M/MV5BMGQ5YTM1NmMtYmIxYy00N2VmLWJhZTYtN2EwYTY3MWFhOTczXkEyXkFqcGdeQXVyNTA2NTI0MTY@._V1_QL75_UX380_CR0,2,380,562_.jpg 380w",http://www.imdb.com/title/tt0118688/?ref_=fn_al_tt_1,Batman and Robin try to keep their relationship together even as they must stop Mr. Freeze and Poison Ivy from freezing Gotham City.,3.8,242K,['Joel Schumacher'],"['Bob Kane', 'Akiva Goldsman']","['Arnold Schwarzenegger', 'George Clooney', ""Chris O'Donnell"", 'Uma Thurman', 'Alicia Silverstone', 'Michael Gough', 'Pat Hingle', 'John Glover', 'Elle Macpherson', 'Vivica A. Fox', 'Vendela Kirsebom', 'Elizabeth Sanders', 'Jeep Swenson', 'John Fink', 'Michael Reid MacKay', 'Eric Lloyd', 'Jon Simmons', 'Christian Boeving']",PG-13,1997.0,2h 5min,27-06-1997,United Kingdom,27-06-1997,United Kingdom,"Batman and Robin are back working side-by-side to stop the villains of Gotham City, but is there tension appearing between them, especially when one villainess who calls herself Poison Ivy can make anyone fall in love with her...literally. Along with Poison Ivy, the icy Mr. Freeze is freezing anything which gets in his way from achieving his goal. —FilmFanUk"
15,[4 7],65,What's Eating Gilbert Grape (1993),"https://m.media-amazon.com/images/M/MV5BY2EyZDlhNjItODYzNi00Mzc3LWJjOWUtMTViODU5MTExZWMyL2ltYWdlXkEyXkFqcGdeQXVyMTQxNzMzNDI@._V1_QL75_UX190_CR0,0,190,281_.jpg 190w, https://m.media-amazon.com/images/M/MV5BY2EyZDlhNjItODYzNi00Mzc3LWJjOWUtMTViODU5MTExZWMyL2ltYWdlXkEyXkFqcGdeQXVyMTQxNzMzNDI@._V1_QL75_UX285_CR0,1,285,422_.jpg 285w, https://m.media-amazon.com/images/M/MV5BY2EyZDlhNjItODYzNi00Mzc3LWJjOWUtMTViODU5MTExZWMyL2ltYWdlXkEyXkFqcGdeQXVyMTQxNzMzNDI@._V1_QL75_UX380_CR0,1,380,562_.jpg 380w",http://www.imdb.com/title/tt0108550/?ref_=fn_al_tt_1,A young man in a small Midwestern town struggles to care for his mentally-disabled younger brother and morbidly obese mother while attempting to pursue his own happiness.,7.7,226K,['Lasse Hallström'],['Peter Hedges'],"['Johnny Depp', 'Leonardo DiCaprio', 'Juliette Lewis', 'Mary Steenburgen', 'Darlene Cates', 'Laura Harrington', 'Mary Kate Schellhardt', 'Kevin Tighe', 'John C. Reilly', 'Crispin Glover', 'Penelope Branning', 'Tim Green', 'Susan Loughran', 'Robert B. Hedges', 'Mark Jordan', 'Cameron Finley', 'Brady Coleman', 'Tim Simek']",PG-13,1993.0,1h 58min,04-03-1994,United Kingdom,04-03-1994,United Kingdom,"There isn't much for Gilbert to look forward to in the small, dying town of Endora. The only thing keeping him sane is his mentally-challenged brother, and his physically-challenged mother. Despite the challenges that are posed in this small town, Gilbert had forgotten that he has become challenged himself and, with the help of a marooned world traveler, begins to see the bigger picture. —Mal Fee Zants"
16,[1 4 7],655,Stand by Me (1986),"https://m.media-amazon.com/images/M/MV5BODJmY2Y2OGQtMDg2My00N2Q3LWJmZTUtYTc2ODBjZDVlNDlhXkEyXkFqcGdeQXVyMTQxNzMzNDI@._V1_QL75_UX190_CR0,9,190,281_.jpg 190w, https://m.media-amazon.com/images/M/MV5BODJmY2Y2OGQtMDg2My00N2Q3LWJmZTUtYTc2ODBjZDVlNDlhXkEyXkFqcGdeQXVyMTQxNzMzNDI@._V1_QL75_UX285_CR0,14,285,422_.jpg 285w, https://m.media-amazon.com/images/M/MV5BODJmY2Y2OGQtMDg2My00N2Q3LWJmZTUtYTc2ODBjZDVlNDlhXkEyXkFqcGdeQXVyMTQxNzMzNDI@._V1_QL75_UX380_CR0,18,380,562_.jpg 380w",http://www.imdb.com/title/tt0092005/?ref_=fn_al_tt_1,"After the death of one of his friends, a writer recounts a childhood journey with his friends to find the body of a missing boy.",8.1,381K,['Rob Reiner'],"['Stephen King', 'Raynold Gideon', 'Bruce A. Evans']","['Wil Wheaton', 'River Phoenix', 'Corey Feldman', ""Jerry O'Connell"", 'Kiefer Sutherland', 'Casey Siemaszko', 'Gary Riley', 'Bradley Gregg', 'Jason Oliver Lipsett', 'Marshall Bell', 'Frances Lee McCain', 'Bruce Kirby', 'William Bronder', 'Scott Beach', 'Richard Dreyfuss', 'John Cusack', 'Madeleine Swift', 'Popeye']",R,1986.0,1h 29min,13-03-1987,United Kingdom,13-03-1987,United Kingdom,"It's the summer of 1959 in Castlerock, Oregon and four 12 year-old boys - Gordie, Chris, Teddy and Vern - are fast friends. After learning of the general location of the body of a local boy who has been missing for several days, they set off into the woods to see it. Along the way, they learn about themselves, the meaning of friendship and the need to stand up for what is right. —garykmcd"
17,[ 7 10],784,Beyond Bedlam (1993),"https://m.media-amazon.com/images/M/MV5BN2E1NDBmOWEtZTc1Zi00OGEyLTk3ZjMtZDg5N2ZhZWM4M2ZiXkEyXkFqcGdeQXVyNjU0NTI0Nw@@._V1_QL75_UX190_CR0,2,190,281_.jpg 190w, https://m.media-amazon.com/images/M/MV5BN2E1NDBmOWEtZTc1Zi00OGEyLTk3ZjMtZDg5N2ZhZWM4M2ZiXkEyXkFqcGdeQXVyNjU0NTI0Nw@@._V1_QL75_UX285_CR0,3,285,422_.jpg 285w, https://m.media-amazon.com/images/M/MV5BN2E1NDBmOWEtZTc1Zi00OGEyLTk3ZjMtZDg5N2ZhZWM4M2ZiXkEyXkFqcGdeQXVyNjU0NTI0Nw@@._V1_QL75_UX380_CR0,4,380,562_.jpg 380w",http://www.imdb.com/title/tt0106402/?ref_=fn_al_tt_1,"Dr. Stephanie Lyell works for Neurological Research, and is testing a seemingly safe personality-altering drug on Marc Gilmour a notorious Serial Killer. But when a pair of bizarre suicides occur at Dr. Lyell's apartment complex, Homicide Detective Terry Hamilton connects the mysterious deaths to the drug's diabolical side effects on Gilmour. Only after they too begin to experience horrible dreams and hallucinations do Terry and Stephanie realize they are trapped in Gilmour's nightmarish world, from which there is no hope of escape.",3.3,501,['Vadim Jean'],"['John Brosnan', 'Vadim Jean', 'Rob Walker']","['Craig Fairbrass', 'Elizabeth Hurley', 'Keith Allen', 'Anita Dobson', 'Jesse Birdsall', 'Craig Kelly', 'Faith Kent', 'Georgina Hale', 'Samantha Spiro', 'Steven Brand', 'Zoe Heyes', 'Annette Badland', 'Natasha Humphrey', 'Jack McKenzie', 'Christopher Adamson', 'Shaun Etherton', 'Andrew Rattenbury', 'Carl Proctor']",R,1994.0,1h 29min,22-04-1994,United Kingdom,22-04-1994,United Kingdom,"Dr. Stephanie Lyell works for Neurological Research, and is testing a seemingly safe personality-altering drug on Marc Gilmour a notorious Serial Killer. But when a pair of bizarre suicides occur at Dr. Lyell's apartment complex, Homicide Detective Terry Hamilton connects the mysterious deaths to the drug's diabolical side effects on Gilmour. Only after they too begin to experience horrible dreams and hallucinations do Terry and Stephanie realize they are trapped in Gilmour's nightmarish world, from which there is no hope of escape. —Anonymous"
18,[4],1114,Faithful (1996),"https://m.media-amazon.com/images/M/MV5BOWQzNGIxNmMtNjhjMS00Njc5LWI1N2MtODczZDEyYjI2M2Q4XkEyXkFqcGdeQXVyNzc5MjA3OA@@._V1_QL75_UX190_CR0,3,190,281_.jpg 190w, https://m.media-amazon.com/images/M/MV5BOWQzNGIxNmMtNjhjMS00Njc5LWI1N2MtODczZDEyYjI2M2Q4XkEyXkFqcGdeQXVyNzc5MjA3OA@@._V1_QL75_UX285_CR0,5,285,422_.jpg 285w, https://m.media-amazon.com/images/M/MV5BOWQzNGIxNmMtNjhjMS00Njc5LWI1N2MtODczZDEyYjI2M2Q4XkEyXkFqcGdeQXVyNzc5MjA3OA@@._V1_QL75_UX380_CR0,7,380,562_.jpg 380w",http://www.imdb.com/title/tt0116269/?ref_=fn_al_tt_1,"A depressed housewife whose husband is having an affair contemplates suicide, but changes her mind when she faces death by a killer hired to do her in.",5.8,2.1K,['Paul Mazursky'],['Chazz Palminteri'],"['Cher', 'Chazz Palminteri', ""Ryan O'Neal"", 'Paul Mazursky', 'Amber Smith', 'Elisa Leonetti', 'Mark Nassar', 'Stephen Spinella', 'Jeffrey Wright', 'David Marino', 'Steven Randazzo', 'Olinda Turturro', 'Max Norat', 'Allison Janney', ""Chris O'Neill"", 'Michael Mulheren', 'Jerry Walsh', 'Gianna Palminteri']",R,1996.0,1h 31min,03-04-1996,United States,03-04-1996,United States,"For their 20th wedding anniversary, Jack gets Maggie a diamond necklace and a hit man. But when Tony shows up and, waiting for the signal from Jack in Connecticut to do the hit, he and Maggie begin to talk - perhaps Tony can come to value Maggie even more than her husband does. And when Jack shows up, things get very tricky. —Bruce Cameron "
19,[7],980,Mother Night (1996),"https://m.media-amazon.com/images/M/MV5BOTgxZGU4MjktMmFhMi00N2U4LWE5ZWUtZTVhZWE1ZTBkMzI4XkEyXkFqcGdeQXVyNjMwMjk0MTQ@._V1_QL75_UX190_CR0,0,190,281_.jpg 190w, https://m.media-amazon.com/images/M/MV5BOTgxZGU4MjktMmFhMi00N2U4LWE5ZWUtZTVhZWE1ZTBkMzI4XkEyXkFqcGdeQXVyNjMwMjk0MTQ@._V1_QL75_UX285_CR0,1,285,422_.jpg 285w, https://m.media-amazon.com/images/M/MV5BOTgxZGU4MjktMmFhMi00N2U4LWE5ZWUtZTVhZWE1ZTBkMzI4XkEyXkFqcGdeQXVyNjMwMjk0MTQ@._V1_QL75_UX380_CR0,1,380,562_.jpg 380w",http://www.imdb.com/title/tt0117093/?ref_=fn_al_tt_1,"An American spy behind the lines during WWII serves as a Nazi propagandist, a role he cannot escape in his future life as he can never reveal his real role in the war.",7.1,5.1K,['Keith Gordon'],"['Kurt Vonnegut Jr.', 'Robert B. Weide']","['Nick Nolte', 'Sheryl Lee', 'Tony Robinow', 'Michael McGill', 'Shimon Aviel', 'Bill Corday', 'Bronwen Mantel', 'Brawley Nolte', 'John Goodman', 'Louis Strauss', 'Zach Grenier', 'Richard Zeman', 'Thomas Hauff', 'Jeff Pufah', 'Norman Rodway', 'Kirsten Dunst', 'David Strathairn', 'Arye Gross']",R,1996.0,1h 54min,14-03-1997,United Kingdom,14-03-1997,United Kingdom,"Howard W. Campbell Jr., an American living in Germany since childhood, is recruited by the United States to become an informer during the upcoming Second World War. What he does become, is one of the leading anti-semitic news broadcasters of Nazi Germany. After the fall of Hitler's Germany, Campbell's government friends arrange for a quiet life in the United States. His life is quiet until a complex web of spies and neo-Nazis draws him back into the life which he once led. Eventually captured by the Isralies, Campbell's one defense was: ""I was an American Spy."" —Anthony Hughes "
20,[2 3],1409,"Swan Princess, The (1994)","https://m.media-amazon.com/images/M/MV5BMzdiMzU5MDctM2U0OC00YzlmLWI2ZTItMTAxMmMzNWFhNzBiXkEyXkFqcGdeQXVyNzMwOTY2NTI@._V1_QL75_UX190_CR0,2,190,281_.jpg 190w, https://m.media-amazon.com/images/M/MV5BMzdiMzU5MDctM2U0OC00YzlmLWI2ZTItMTAxMmMzNWFhNzBiXkEyXkFqcGdeQXVyNzMwOTY2NTI@._V1_QL75_UX285_CR0,3,285,422_.jpg 285w, https://m.media-amazon.com/images/M/MV5BMzdiMzU5MDctM2U0OC00YzlmLWI2ZTItMTAxMmMzNWFhNzBiXkEyXkFqcGdeQXVyNzMwOTY2NTI@._V1_QL75_UX380_CR0,4,380,562_.jpg 380w",http://www.imdb.com/title/tt0149215/?ref_=fn_al_tt_1,Evil sorceress Zelda kidnaps the Swan Princess in order to wreak havoc on the peaceful land of Swan Lake.,5.7,2.3K,['Richard Rich'],"['Brian Nissen', 'Richard Rich']","['Michelle Nicastro', 'Brian Nissen', 'Katja Zoch', 'Joseph Medrano', 'Christy Landers', 'Donald Sage Mackay', 'Doug Stone', 'Steve Vinovich', 'Paul Masonson', 'Owen Miller', 'Sean Smith']",,,,04-08-1998,United States,04-08-1998,United States,"The royal couple Odette and Derek face yet another evil magician, this time a woman named Zelda. Lusting for the treasure of the Forbidden Arts, which will give her absolute power, Zelda kidnaps Odette and Jean-Bob as ransom. Derek, Speed, and Puffin head off to rescue them. —Anonymous"
21,[7],262,In the Company of Men (1997),"https://m.media-amazon.com/images/M/MV5BYmFiZTI1MDUtNGYyMi00ZTRkLWE1Y2UtZWY0ZDZiZTBiMjRmXkEyXkFqcGdeQXVyMTAwMzUyOTc@._V1_QL75_UX190_CR0,0,190,281_.jpg 190w, https://m.media-amazon.com/images/M/MV5BYmFiZTI1MDUtNGYyMi00ZTRkLWE1Y2UtZWY0ZDZiZTBiMjRmXkEyXkFqcGdeQXVyMTAwMzUyOTc@._V1_QL75_UX285_CR0,1,285,422_.jpg 285w, https://m.media-amazon.com/images/M/MV5BYmFiZTI1MDUtNGYyMi00ZTRkLWE1Y2UtZWY0ZDZiZTBiMjRmXkEyXkFqcGdeQXVyMTAwMzUyOTc@._V1_QL75_UX380_CR0,1,380,562_.jpg 380w",http://www.imdb.com/title/tt0119361/?ref_=fn_al_tt_1,"Two business executives--one an avowed misogynist, the other recently emotionally wounded by his love interest--set out to exact revenge on the female gender by seeking out the most innocent, uncorrupted girl they can find and ruining her life.",7.2,13K,['Neil LaBute'],['Neil LaBute'],"['Aaron Eckhart', 'Matt Malloy', 'Stacy Edwards', 'Michael Martin', 'Mark Rector', 'Chris Hayes', 'Jason Dixie', 'Emily Cline', 'Roxanne Butler', 'Tahirah Essix', 'Julia Henkel', 'Sara Pauley', 'Cheryl Russell', 'Jasen Savage', 'Lynette Smith', 'William Young', 'Tamara Reiter', 'Chan Aye']",R,1997.0,1h 37min,30-01-1998,United Kingdom,30-01-1998,United Kingdom,"Two junior executives on a six-week business trip, both of whom have been recently hurt by women, devise a horrible plan to get even with women for their past hurts: They intend to find, romance, and then dump a vulnerable woman. They choose Christine, and for a while all goes according to plan. However, it soon becomes clear that things are not as simple as they think. —"
22,[ 7 14],283,Emma (1996),"https://m.media-amazon.com/images/M/MV5BN2E1YTUzZDAtODQ2YS00MWNjLWEzMzAtZjgwY2M3ZTcwOTJhXkEyXkFqcGdeQXVyNjE5MjUyOTM@._V1_QL75_UY281_CR1,0,190,281_.jpg 190w, https://m.media-amazon.com/images/M/MV5BN2E1YTUzZDAtODQ2YS00MWNjLWEzMzAtZjgwY2M3ZTcwOTJhXkEyXkFqcGdeQXVyNjE5MjUyOTM@._V1_QL75_UY422_CR2,0,285,422_.jpg 285w, https://m.media-amazon.com/images/M/MV5BN2E1YTUzZDAtODQ2YS00MWNjLWEzMzAtZjgwY2M3ZTcwOTJhXkEyXkFqcGdeQXVyNjE5MjUyOTM@._V1_QL75_UY562_CR2,0,380,562_.jpg 380w",http://www.imdb.com/title/tt0116191/?ref_=fn_al_tt_1,"While matchmaking for friends and neighbours, a young 19th Century Englishwoman nearly misses her own chance at love.",6.7,38K,['Douglas McGrath'],"['Jane Austen', 'Douglas McGrath']","['Gwyneth Paltrow', 'James Cosmo', 'Greta Scacchi', 'Alan Cumming', 'Denys Hawthorne', 'Sophie Thompson', 'Jeremy Northam', 'Toni Collette', 'Kathleen Byron', 'Phyllida Law', 'Edward Woodall', 'Brett Miley', 'Brian Capron', 'Karen Westwood', 'Paul Williamson', 'Polly Walker', 'Rebecca Craig', 'Ewan McGregor']",PG,1996.0,2h,13-09-1996,United Kingdom,13-09-1996,United Kingdom,"Emma Woodhouse is a congenial young lady who delights in meddling in other people's affairs. She is perpetually trying to unite men and women who are utterly wrong for each other. Despite her interest in romance, Emma is clueless about her own feelings, and her relationship with gentle Mr. Knightley. —Philip Brubaker "
23,[ 7 14],903,Afterglow (1997),"https://m.media-amazon.com/images/M/MV5BYjVlYjYzNzktYjA4Ny00ZTk2LTlmNTUtYTI5OTZkOTE2YzU4XkEyXkFqcGdeQXVyMTAwMzUyOTc@._V1_QL75_UY281_CR1,0,190,281_.jpg 190w, https://m.media-amazon.com/images/M/MV5BYjVlYjYzNzktYjA4Ny00ZTk2LTlmNTUtYTI5OTZkOTE2YzU4XkEyXkFqcGdeQXVyMTAwMzUyOTc@._V1_QL75_UY422_CR2,0,285,422_.jpg 285w, https://m.media-amazon.com/images/M/MV5BYjVlYjYzNzktYjA4Ny00ZTk2LTlmNTUtYTI5OTZkOTE2YzU4XkEyXkFqcGdeQXVyMTAwMzUyOTc@._V1_QL75_UY562_CR3,0,380,562_.jpg 380w",http://www.imdb.com/title/tt0118566/?ref_=fn_al_tt_1,A handyman with marital problems meets a housewife with the same.,6.1,3.5K,['Alan Rudolph'],['Alan Rudolph'],"['Nick Nolte', 'Julie Christie', 'Lara Flynn Boyle', 'Jonny Lee Miller', 'Jay Underwood', 'Domini Blythe', 'Yves Corbeil', 'Alan Fawcett', 'Michèle-Barbara Pelletier', 'France Castel', 'Genevieve Bissonnette', 'Claudia Besso', 'Ivan Smith', 'Ellen David', 'Don Jordan', 'Bill Rowat', 'Cas Anvar', 'David Francis']",R,1997.0,1h 59min,29-05-1998,United Kingdom,29-05-1998,United Kingdom,"Two families are unhappy with their respective relationships: first of ambitious businessman Jeffrey Byron and sexually frustrated Marianne and second of repair contractor Lucky Mann and former B-movie actress Phyllis. When Lucky arrives to Byron's apartment to make some minor repair and Marianne becomes obsessed with him, the everyday balance breaks. —Anonymous"
24,[7],1389,Mondo (1996),"https://m.media-amazon.com/images/M/MV5BMzg5YWIxZTgtODJiZC00ZDQ2LWFjYTUtNDNkMjlkZGZmN2I0XkEyXkFqcGdeQXVyMTk5MjAyMjM@._V1_QL75_UY281_CR11,0,190,281_.jpg 190w, https://m.media-amazon.com/images/M/MV5BMzg5YWIxZTgtODJiZC00ZDQ2LWFjYTUtNDNkMjlkZGZmN2I0XkEyXkFqcGdeQXVyMTk5MjAyMjM@._V1_QL75_UY422_CR16,0,285,422_.jpg 285w, https://m.media-amazon.com/images/M/MV5BMzg5YWIxZTgtODJiZC00ZDQ2LWFjYTUtNDNkMjlkZGZmN2I0XkEyXkFqcGdeQXVyMTk5MjAyMjM@._V1_QL75_UY562_CR21,0,380,562_.jpg 380w",http://www.imdb.com/title/tt0118163/?ref_=fn_al_tt_1,"In 1933 Texas, a schoolteacher and aspiring writer meets a pulp fiction writer, and a relationship soon develops between the two, but it is doomed by his slavishly devotion to his ailing mother and insistence on his freedom.",7.1,3.6K,['Dan Ireland'],"['Novalyne Price Ellis', 'Michael Scott Myers']","[""Vincent D'Onofrio"", 'Renée Zellweger', 'Ann Wedgeworth', 'Harve Presnell', 'Benjamin Mouton', 'Helen Cates', 'Leslie Buesing', 'Chris Shearer', 'Sandy Walper', 'Marion Eaton', 'Dell Aldrich', 'Libby Villari', 'Michael Corbett', 'Antonia Bogdanovich', ""Elizabeth D'Onofrio"", 'Stephen Marshall', 'Bridgett']",PG,1996.0,1h 51min,20-12-1996,United States,20-12-1996,United States,"In Texas in the 1930s, young schoolteacher Novalyne Price (Renée Zellweger) meets a handsome, eccentric, interesting young man named Robert E. Howard (Vincent D'Onofrio). He's a successful writer of the pulp stories of ""Conan the Barbarian"", and she's an aspiring one. A friendship develops into a sort of courtship. Based on a memoir by Novalyne Price. —Eileen Berdon "
25,[ 0  5 16],1139,Hackers (1995),"https://m.media-amazon.com/images/M/MV5BNmExMTkyYjItZTg0YS00NWYzLTkwMjItZWJiOWQ2M2ZkYjE4XkEyXkFqcGdeQXVyMTQxNzMzNDI@._V1_QL75_UX190_CR0,0,190,281_.jpg 190w, https://m.media-amazon.com/images/M/MV5BNmExMTkyYjItZTg0YS00NWYzLTkwMjItZWJiOWQ2M2ZkYjE4XkEyXkFqcGdeQXVyMTQxNzMzNDI@._V1_QL75_UX285_CR0,0,285,422_.jpg 285w, https://m.media-amazon.com/images/M/MV5BNmExMTkyYjItZTg0YS00NWYzLTkwMjItZWJiOWQ2M2ZkYjE4XkEyXkFqcGdeQXVyMTQxNzMzNDI@._V1_QL75_UX380_CR0,0,380,562_.jpg 380w",http://www.imdb.com/title/tt0113243/?ref_=fn_al_tt_1,Hackers are blamed for making a virus that will capsize five oil tankers.,6.2,68K,['Iain Softley'],['Rafael Moreu'],"['Jonny Lee Miller', 'Angelina Jolie', 'Jesse Bradford', 'Matthew Lillard', 'Laurence Mason', 'Renoly Santiago', 'Fisher Stevens', 'Alberta Watson', 'Darren Lee', 'Peter Kim', 'Ethan Browne', 'Lorraine Bracco', 'Wendell Pierce', 'Michael Gaston', 'Marc Anthony', 'Penn Jillette', 'Liza Walker', 'Bob Sessions']",PG-13,1995.0,1h 45min,03-05-1996,United Kingdom,03-05-1996,United Kingdom,"A young boy is arrested by the U.S. Secret Service for writing a computer virus and is banned from using a computer until his 18th birthday. Years later, he and his new-found friends discover a plot to unleash a dangerous computer virus, but they must use their computer skills to find the evidence while being pursued by the Secret Service and the evil computer genius behind the virus. —Wiki"
26,[3 7],626,So Dear to My Heart (1949),"https://m.media-amazon.com/images/M/MV5BMWFmMDgxMzctYzYyMy00YTNmLWJhMjUtMmUwODRkYmFmYmNhXkEyXkFqcGdeQXVyMTQ3Njg3MQ@@._V1_QL75_UX190_CR0,6,190,281_.jpg 190w, https://m.media-amazon.com/images/M/MV5BMWFmMDgxMzctYzYyMy00YTNmLWJhMjUtMmUwODRkYmFmYmNhXkEyXkFqcGdeQXVyMTQ3Njg3MQ@@._V1_QL75_UX285_CR0,9,285,422_.jpg 285w, https://m.media-amazon.com/images/M/MV5BMWFmMDgxMzctYzYyMy00YTNmLWJhMjUtMmUwODRkYmFmYmNhXkEyXkFqcGdeQXVyMTQ3Njg3MQ@@._V1_QL75_UX380_CR0,12,380,562_.jpg 380w",http://www.imdb.com/title/tt0041890/?ref_=fn_al_tt_1,This heartwarming classic tells the tale of a country boy who adopts a mischevious black lamb and learns valuable lessons about love and dedication.,6.8,1.4K,"['Harold D. Schuster', 'Hamilton Luske']","['John Tucker Battle', 'Maurice Rapf', 'Ted Sears']","['Burl Ives', 'Beulah Bondi', 'Bobby Driscoll', 'Luana Patten', 'Harry Carey', 'Raymond Bond', 'Walter Soderling', 'Matt Willis', 'Spelman B. Collins', 'John Beal', 'Ken Carson', 'Bob Haymes', ""Jud Conlon's Rhythmaires"", 'Danny', 'Stewart Bair', 'Fred Carter', 'Emett Casey', 'Jack Chase']",Passed,1948.0,1h 19min,22-12-1949,United Kingdom,22-12-1949,United Kingdom,This heartwarming classic tells the tale of a country boy who adopts a mischevious black lamb and learns valuable lessons about love and dedication.
27,[ 3  4 12],91,"Nightmare Before Christmas, The (1993)","https://m.media-amazon.com/images/M/MV5BNWE4OTNiM2ItMjY4Ni00ZTViLWFiZmEtZGEyNGY2ZmNlMzIyXkEyXkFqcGdeQXVyMDU5NDcxNw@@._V1_QL75_UX190_CR0,2,190,281_.jpg 190w, https://m.media-amazon.com/images/M/MV5BNWE4OTNiM2ItMjY4Ni00ZTViLWFiZmEtZGEyNGY2ZmNlMzIyXkEyXkFqcGdeQXVyMDU5NDcxNw@@._V1_QL75_UX285_CR0,3,285,422_.jpg 285w, https://m.media-amazon.com/images/M/MV5BNWE4OTNiM2ItMjY4Ni00ZTViLWFiZmEtZGEyNGY2ZmNlMzIyXkEyXkFqcGdeQXVyMDU5NDcxNw@@._V1_QL75_UX380_CR0,4,380,562_.jpg 380w",http://www.imdb.com/title/tt0107688/?ref_=fn_al_tt_1,"Jack Skellington, king of Halloween Town, discovers Christmas Town, but his attempts to bring Christmas to his home causes confusion.",8.0,312K,['Henry Selick'],"['Tim Burton', 'Michael McDowell', 'Caroline Thompson']","['Danny Elfman', 'Chris Sarandon', ""Catherine O'Hara"", 'William Hickey', 'Glenn Shadix', 'Paul Reubens', 'Ken Page', 'Edward Ivory', 'Susan McBride', 'Debi Durst', 'Greg Proops', 'Kerry Katz', 'Randy Crenshaw', 'Sherwood Ball', 'Carmen Twillie', 'Glenn Walters', 'Mia Brown', 'L. Peter Callender']",PG,1993.0,1h 16min,25-11-1994,United Kingdom,25-11-1994,United Kingdom,"Jack Skellington, the pumpkin king of Halloween Town, is bored with doing the same thing every year for Halloween. One day he stumbles into Christmas Town, and is so taken with the idea of Christmas that he tries to get the resident bats, ghouls, and goblins of Halloween Town to help him put on Christmas instead of Halloween -- but alas, they can't get it quite right. —Jon Reeves "
28,[13 16],291,Absolute Power (1997),"https://m.media-amazon.com/images/M/MV5BNDFlNTZmOGYtYmE0ZC00OTE4LWI5YzctNmZmZDU3M2ZiMmI4XkEyXkFqcGdeQXVyNDk3NzU2MTQ@._V1_QL75_UY281_CR1,0,190,281_.jpg 190w, https://m.media-amazon.com/images/M/MV5BNDFlNTZmOGYtYmE0ZC00OTE4LWI5YzctNmZmZDU3M2ZiMmI4XkEyXkFqcGdeQXVyNDk3NzU2MTQ@._V1_QL75_UY422_CR1,0,285,422_.jpg 285w, https://m.media-amazon.com/images/M/MV5BNDFlNTZmOGYtYmE0ZC00OTE4LWI5YzctNmZmZDU3M2ZiMmI4XkEyXkFqcGdeQXVyNDk3NzU2MTQ@._V1_QL75_UY562_CR1,0,380,562_.jpg 380w",http://www.imdb.com/title/tt0118548/?ref_=fn_al_tt_1,Career thief Luther Whitney (Clint Eastwood) witnesses a horrific crime involving U.S. President Alan Richmond (Gene Hackman).,6.7,53K,['Clint Eastwood'],"['David Baldacci', 'William Goldman']","['Clint Eastwood', 'Gene Hackman', 'Ed Harris', 'Laura Linney', 'Scott Glenn', 'Dennis Haysbert', 'Judy Davis', 'E.G. Marshall', 'Melora Hardin', 'Kenneth Welsh', 'Penny Johnson Jerald', 'Richard Jenkins', 'Mark Margolis', 'Elaine Kagan', 'Alison Eastwood', 'Yau-Gene Chan', 'George Orrison', 'Charles McDaniel']",R,1997.0,2h 1min,30-05-1997,United Kingdom,30-05-1997,United Kingdom,"Inspired by David Baldacci's novel, and the ruthlessness of people in power. President Alan Richmond believes that everything he does is beyond reproach, including an affair or two. That leads to murder and everyone around him is involved. There is only one witness, a thief named Luther Whitney. They are sure he'll talk, but when? The Secret Service is determined to keep him quiet, but catching a thief isn't always easy. —Kristie Murray "
